Type;Bereich;Bezeichnung;Anzahl KH;AnzahlTS
3;N98;Komplikationen im Zusammenhang mit künstlicher Befruchtung;0;0
3;N99;Krankheiten des Urogenitalsystems nach medizinischen Maßnahmen, anderenorts nicht klassifiziert;9;11
3;O00;Extrauteringravidität;6;9
3;O01;Blasenmole;5;10
3;O02;Sonstige abnorme Konzeptionsprodukte;4;25
3;O03;Spontanabort;2;2
3;O04;Ärztlich eingeleiteter Abort;-999;-999
3;O05;Sonstiger Abort;0;0
3;O06;Nicht näher bezeichneter Abort;-999;-999
3;O07;Misslungene Aborteinleitung;0;0
3;O08;Komplikationen nach Abort, Extrauteringravidität und Molenschwangerschaft;-999;-999
3;O09;Schwangerschaftsdauer;0;0
3;O10;Vorher bestehende Hypertonie, die Schwangerschaft, Geburt und Wochenbett kompliziert;0;0
3;O11;Vorher bestehende chronische Hypertonie mit aufgepfropfter Präeklampsie, die Schwangerschaft, Geburt und Wochenbett kompliziert;0;0
3;O12;Gestationsödeme und Gestationsproteinurie [schwangerschaftsinduziert] ohne Hypertonie;0;0
3;O13;Gestationshypertonie [schwangerschaftsinduzierte Hypertonie];0;0
3;O14;Präeklampsie;-999;-999
3;O15;Eklampsie;-999;-999
3;O16;Nicht näher bezeichnete Hypertonie der Mutter;0;0
3;O20;Blutung in der Frühschwangerschaft;0;0
3;O21;Übermäßiges Erbrechen während der Schwangerschaft;0;0
3;O22;Venenkrankheiten und Hämorrhoiden als Komplikationen in der Schwangerschaft;0;0
3;O23;Infektionen des Urogenitaltraktes in der Schwangerschaft;-999;-999
3;O24;Diabetes mellitus in der Schwangerschaft;9;352
3;O25;Fehl- und Mangelernährung in der Schwangerschaft;0;0
3;O26;Betreuung der Mutter bei sonstigen Zuständen, die vorwiegend mit der Schwangerschaft verbunden sind;3;6
3;O28;Abnorme Befunde bei der Screeninguntersuchung der Mutter zur pränatalen Diagnostik;0;0
3;O29;Komplikationen bei Anästhesie in der Schwangerschaft;0;0
3;O30;Mehrlingsschwangerschaft;0;0
3;O31;Komplikationen, die für eine Mehrlingsschwangerschaft spezifisch sind;0;0
3;O32;Betreuung der Mutter bei festgestellter oder vermuteter Lage- und Einstellungsanomalie des Feten;3;191
3;O33;Betreuung der Mutter bei festgestelltem oder vermutetem Missverhältnis zwischen Fetus und Becken;0;0
3;O34;Betreuung der Mutter bei festgestellter oder vermuteter Anomalie der Beckenorgane;-999;-999
3;O35;Betreuung der Mutter bei festgestellter oder vermuteter Anomalie oder Schädigung des Feten;-999;-999
3;O36;Betreuung der Mutter wegen sonstiger festgestellter oder vermuteter Komplikationen beim Feten;-999;-999
3;O40;Polyhydramnion;0;0
3;O41;Sonstige Veränderungen des Fruchtwassers und der Eihäute;0;0
3;O42;Vorzeitiger Blasensprung;0;0
3;O43;Pathologische Zustände der Plazenta;0;0
3;O44;Placenta praevia;0;0
3;O45;Vorzeitige Plazentalösung [Abruptio placentae];0;0
3;O46;Präpartale Blutung, anderenorts nicht klassifiziert;-999;-999
3;O47;Frustrane Kontraktionen [Unnütze Wehen];-999;-999
3;O48;Übertragene Schwangerschaft;0;0
3;O60;Vorzeitige Wehen und Entbindung;-999;-999
3;O61;Misslungene Geburtseinleitung;0;0
3;O62;Abnorme Wehentätigkeit;0;0
3;O63;Protrahierte Geburt;0;0
3;O64;Geburtshindernis durch Lage-, Haltungs- und Einstellungsanomalien des Feten;2;6
3;O65;Geburtshindernis durch Anomalie des mütterlichen Beckens;0;0
3;O66;Sonstiges Geburtshindernis;0;0
3;O67;Komplikationen bei Wehen und Entbindung durch intrapartale Blutung, anderenorts nicht klassifiziert;0;0
3;O68;Komplikationen bei Wehen und Entbindung durch fetalen Distress [fetal distress] [fetaler Gefahrenzustand];0;0
3;O69;Komplikationen bei Wehen und Entbindung durch Nabelschnurkomplikationen;0;0
3;O70;Dammriss unter der Geburt;-999;-999
3;O71;Sonstige Verletzungen unter der Geburt;0;0
3;O72;Postpartale Blutung;2;2
3;O73;Retention der Plazenta und der Eihäute ohne Blutung;-999;-999
3;O74;Komplikationen bei Anästhesie während der Wehentätigkeit und bei der Entbindung;0;0
3;O75;Sonstige Komplikationen bei Wehentätigkeit und Entbindung, anderenorts nicht klassifiziert;0;0
3;O80;Spontangeburt eines Einlings;0;0
3;O81;Geburt eines Einlings durch Zangen- oder Vakuumextraktion;0;0
3;O82;Geburt eines Einlings durch Schnittentbindung [Sectio caesarea];0;0
3;O85;Puerperalfieber;0;0
3;O86;Sonstige Wochenbettinfektionen;0;0
3;O87;Venenkrankheiten und Hämorrhoiden als Komplikationen im Wochenbett;0;0
3;O88;Embolie während der Gestationsperiode;0;0
3;O89;Komplikationen bei Anästhesie im Wochenbett;0;0
3;O90;Wochenbettkomplikationen, anderenorts nicht klassifiziert;3;6
3;O91;Infektionen der Mamma [Brustdrüse] im Zusammenhang mit der Gestation;0;0
3;O92;Sonstige Krankheiten der Mamma [Brustdrüse] im Zusammenhang mit der Gestation und Laktationsstörungen;0;0
3;O94;Folgen von Komplikationen während Schwangerschaft, Geburt und Wochenbett;0;0
3;O95;Sterbefall während der Gestationsperiode nicht näher bezeichneter Ursache;0;0
3;O96;Tod infolge jeder gestationsbedingten Ursache nach mehr als 42 Tagen bis unter einem Jahr nach der Entbindung;0;0
3;O97;Tod an den Folgen gestationsbedingter Ursachen;0;0
3;O98;Infektiöse und parasitäre Krankheiten der Mutter, die anderenorts klassifizierbar sind, die jedoch Schwangerschaft, Geburt und Wochenbett komplizieren;3;18
3;O99;Sonstige Krankheiten der Mutter, die anderenorts klassifizierbar sind, die jedoch Schwangerschaft, Geburt und Wochenbett komplizieren;7;22
3;P00;Schädigung des Feten und Neugeborenen durch Zustände der Mutter, die zur vorliegenden Schwangerschaft keine Beziehung haben müssen;-999;-999
3;P01;Schädigung des Feten und Neugeborenen durch mütterliche Schwangerschaftskomplikationen;0;0
3;P02;Schädigung des Feten und Neugeborenen durch Komplikationen von Plazenta, Nabelschnur und Eihäuten;2;2
3;P03;Schädigung des Feten und Neugeborenen durch sonstige Komplikationen bei Wehen und Entbindung;0;0
3;P04;Schädigung des Feten und Neugeborenen durch Noxen, die transplazentar oder mit der Muttermilch übertragen werden;0;0
3;P05;Intrauterine Mangelentwicklung und fetale Mangelernährung;0;0
3;P07;Störungen im Zusammenhang mit kurzer Schwangerschaftsdauer und niedrigem Geburtsgewicht, anderenorts nicht klassifiziert;11;33
3;P08;Störungen im Zusammenhang mit langer Schwangerschaftsdauer und hohem Geburtsgewicht;0;0
3;P10;Intrakranielle Verletzung und Blutung durch Geburtsverletzung;0;0
3;P11;Sonstige Geburtsverletzungen des Zentralnervensystems;0;0
3;P12;Geburtsverletzung der behaarten Kopfhaut;-999;-999
3;P13;Geburtsverletzung des Skeletts;-999;-999
3;P14;Geburtsverletzung des peripheren Nervensystems;-999;-999
3;P15;Sonstige Geburtsverletzungen;0;0
3;P20;Intrauterine Hypoxie;3;3
3;P21;Asphyxie unter der Geburt;4;6
3;P22;Atemnot [Respiratory distress] beim Neugeborenen;4;5
3;P23;Angeborene Pneumonie;0;0
3;P24;Aspirationssyndrome beim Neugeborenen;0;0
3;P25;Interstitielles Emphysem und verwandte Zustände mit Ursprung in der Perinatalperiode;0;0
3;P26;Lungenblutung mit Ursprung in der Perinatalperiode;0;0
3;P27;Chronische Atemwegskrankheit mit Ursprung in der Perinatalperiode;4;6
3;P28;Sonstige Störungen der Atmung mit Ursprung in der Perinatalperiode;6;20
3;P29;Kardiovaskuläre Krankheiten mit Ursprung in der Perinatalperiode;2;2
3;P35;Angeborene Viruskrankheiten;5;12
3;P36;Bakterielle Sepsis beim Neugeborenen;0;0
3;P37;Sonstige angeborene infektiöse und parasitäre Krankheiten;-999;-999
3;P38;Omphalitis beim Neugeborenen mit oder ohne leichte Blutung;0;0
3;P39;Sonstige Infektionen, die für die Perinatalperiode spezifisch sind;0;0
3;P50;Fetaler Blutverlust;0;0
3;P51;Nabelblutung beim Neugeborenen;0;0
3;P52;Intrakranielle nichttraumatische Blutung beim Feten und Neugeborenen;2;2
3;P53;Hämorrhagische Krankheit beim Feten und Neugeborenen;0;0
3;P54;Sonstige Blutungen beim Neugeborenen;0;0
3;P55;Hämolytische Krankheit beim Feten und Neugeborenen;-999;-999
3;P56;Hydrops fetalis durch hämolytische Krankheit;0;0
3;P57;Kernikterus;0;0
3;P58;Neugeborenenikterus durch sonstige gesteigerte Hämolyse;-999;-999
3;P59;Neugeborenenikterus durch sonstige und nicht näher bezeichnete Ursachen;8;14
3;P60;Disseminierte intravasale Gerinnung beim Feten und Neugeborenen;0;0
3;P61;Sonstige hämatologische Krankheiten in der Perinatalperiode;0;0
3;P70;Transitorische Störungen des Kohlenhydratstoffwechsels, die für den Feten und das Neugeborene spezifisch sind;-999;-999
3;P71;Transitorische Störungen des Kalzium- und Magnesiumstoffwechsels beim Neugeborenen;-999;-999
3;P72;Sonstige transitorische endokrine Krankheiten beim Neugeborenen;0;0
3;P74;Sonstige transitorische Störungen des Elektrolythaushaltes und des Stoffwechsels beim Neugeborenen;0;0
3;P75;Mekoniumileus bei zystischer Fibrose;0;0
3;P76;Sonstiger Darmverschluss beim Neugeborenen;0;0
3;P77;Enterocolitis necroticans beim Feten und Neugeborenen;2;4
3;P78;Sonstige Krankheiten des Verdauungssystems in der Perinatalperiode;0;0
3;P80;Hypothermie beim Neugeborenen;0;0
3;P81;Sonstige Störungen der Temperaturregulation beim Neugeborenen;0;0
3;P83;Sonstige Krankheitszustände mit Beteiligung der Haut, die für den Feten und das Neugeborene spezifisch sind;2;2
3;P90;Krämpfe beim Neugeborenen;5;7
3;P91;Sonstige zerebrale Störungen beim Neugeborenen;6;9
3;P92;Ernährungsprobleme beim Neugeborenen;4;6
3;P93;Reaktionen und Intoxikationen durch Arzneimittel oder Drogen, die dem Feten und Neugeborenen verabreicht wurden;0;0
3;P94;Störungen des Muskeltonus beim Neugeborenen;9;18
3;P95;Fetaltod nicht näher bezeichneter Ursache;0;0
3;P96;Sonstige Zustände, die ihren Ursprung in der Perinatalperiode haben;-999;-999
3;Q00;Anenzephalie und ähnliche Fehlbildungen;2;2
3;Q01;Enzephalozele;3;3
3;Q02;Mikrozephalie;20;60
3;Q03;Angeborener Hydrozephalus;24;87
3;Q04;Sonstige angeborene Fehlbildungen des Gehirns;32;89
3;Q05;Spina bifida;28;269
3;Q06;Sonstige angeborene Fehlbildungen des Rückenmarks;19;52
3;Q07;Sonstige angeborene Fehlbildungen des Nervensystems;14;28
3;Q10;Angeborene Fehlbildungen des Augenlides, des Tränenapparates und der Orbita;9;43
3;Q11;Anophthalmus, Mikrophthalmus und Makrophthalmus;2;2
3;Q12;Angeborene Fehlbildungen der Linse;4;4
3;Q13;Angeborene Fehlbildungen des vorderen Augenabschnittes;10;13
3;Q14;Angeborene Fehlbildung des hinteren Augenabschnittes;3;3
3;Q15;Sonstige angeborene Fehlbildungen des Auges;7;19
3;Q16;Angeborene Fehlbildungen des Ohres, die eine Beeinträchtigung des Hörvermögens verursachen;3;3
3;Q17;Sonstige angeborene Fehlbildungen des Ohres;9;32
3;Q18;Sonstige angeborene Fehlbildungen des Gesichtes und des Halses;14;33
3;Q20;Angeborene Fehlbildungen der Herzhöhlen und verbindender Strukturen;9;71
3;Q21;Angeborene Fehlbildungen der Herzsepten;17;298
3;Q22;Angeborene Fehlbildungen der Pulmonal- und der Trikuspidalklappe;8;45
3;Q23;Angeborene Fehlbildungen der Aorten- und der Mitralklappe;7;116
3;Q24;Sonstige angeborene Fehlbildungen des Herzens;10;41
3;Q25;Angeborene Fehlbildungen der großen Arterien;15;102
3;Q26;Angeborene Fehlbildungen der großen Venen;5;10
3;Q27;Sonstige angeborene Fehlbildungen des peripheren Gefäßsystems;12;20
3;Q28;Sonstige angeborene Fehlbildungen des Kreislaufsystems;18;54
3;Q30;Angeborene Fehlbildungen der Nase;2;3
3;Q31;Angeborene Fehlbildungen des Kehlkopfes;-999;-999
3;Q32;Angeborene Fehlbildungen der Trachea und der Bronchien;7;8
3;Q33;Angeborene Fehlbildungen der Lunge;11;15
3;Q34;Sonstige angeborene Fehlbildungen des Atmungssystems;4;8
3;Q35;Gaumenspalte;3;7
3;Q36;Lippenspalte;2;2
3;Q37;Gaumenspalte mit Lippenspalte;6;30
3;Q38;Sonstige angeborene Fehlbildungen der Zunge, des Mundes und des Rachens;7;12
3;Q39;Angeborene Fehlbildungen des Ösophagus;13;30
3;Q40;Sonstige angeborene Fehlbildungen des oberen Verdauungstraktes;3;3
3;Q41;Angeborene(s) Fehlen, Atresie und Stenose des Dünndarmes;-999;-999
3;Q42;Angeborene(s) Fehlen, Atresie und Stenose des Dickdarmes;10;81
3;Q43;Sonstige angeborene Fehlbildungen des Darmes;17;85
3;Q44;Angeborene Fehlbildungen der Gallenblase, der Gallengänge und der Leber;9;26
3;Q45;Sonstige angeborene Fehlbildungen des Verdauungssystems;3;3
3;Q50;Angeborene Fehlbildungen der Ovarien, der Tubae uterinae und der Ligg. lata uteri;2;5
3;Q51;Angeborene Fehlbildungen des Uterus und der Cervix uteri;0;0
3;Q52;Sonstige angeborene Fehlbildungen der weiblichen Genitalorgane;9;18
3;Q53;Nondescensus testis;10;13
3;Q54;Hypospadie;9;11
3;Q55;Sonstige angeborene Fehlbildungen der männlichen Genitalorgane;7;8
3;Q56;Unbestimmtes Geschlecht und Pseudohermaphroditismus;2;3
3;Q60;Nierenagenesie und sonstige Reduktionsdefekte der Niere;18;97
3;Q61;Zystische Nierenkrankheit;22;196
3;Q62;Angeborene obstruktive Defekte des Nierenbeckens und angeborene Fehlbildungen des Ureters;37;911
3;Q63;Sonstige angeborene Fehlbildungen der Niere;24;155
3;Q64;Sonstige angeborene Fehlbildungen des Harnsystems;20;88
3;Q65;Angeborene Deformitäten der Hüfte;8;12
3;Q66;Angeborene Deformitäten der Füße;17;37
3;Q67;Angeborene Muskel-Skelett-Deformitäten des Kopfes, des Gesichtes, der Wirbelsäule und des Thorax;16;28
3;Q68;Sonstige angeborene Muskel-Skelett-Deformitäten;5;6
3;Q69;Polydaktylie;5;6
3;Q70;Syndaktylie;-999;-999
3;Q71;Reduktionsdefekte der oberen Extremität;-999;-999
3;Q72;Reduktionsdefekte der unteren Extremität;6;8
3;Q73;Reduktionsdefekte nicht näher bezeichneter Extremität(en);0;0
3;Q74;Sonstige angeborene Fehlbildungen der Extremität(en);9;17
3;Q75;Sonstige angeborene Fehlbildungen der Schädel- und Gesichtsschädelknochen;26;117
3;Q76;Angeborene Fehlbildungen der Wirbelsäule und des knöchernen Thorax;16;54
3;Q77;Osteochondrodysplasie mit Wachstumsstörungen der Röhrenknochen und der Wirbelsäule;14;25
3;Q78;Sonstige Osteochondrodysplasien;29;154
3;Q79;Angeborene Fehlbildungen des Muskel-Skelett-Systems, anderenorts nicht klassifiziert;9;21
3;Q80;Ichthyosis congenita;12;13
3;Q81;Epidermolysis bullosa;8;139
3;Q82;Sonstige angeborene Fehlbildungen der Haut;50;467
3;Q83;Angeborene Fehlbildungen der Mamma [Brustdrüse];0;0
3;Q84;Sonstige angeborene Fehlbildungen des Integumentes;5;8
3;Q85;Phakomatosen, anderenorts nicht klassifiziert;51;389
3;Q86;Angeborene Fehlbildungssyndrome durch bekannte äußere Ursachen, anderenorts nicht klassifiziert;3;3
3;Q87;Sonstige näher bezeichnete angeborene Fehlbildungssyndrome mit Beteiligung mehrerer Systeme;29;117
3;Q89;Sonstige angeborene Fehlbildungen, anderenorts nicht klassifiziert;15;19
3;Q90;Down-Syndrom;16;27
3;Q91;Edwards-Syndrom und Patau-Syndrom;0;0
3;Q92;Sonstige Trisomien und partielle Trisomien der Autosomen, anderenorts nicht klassifiziert;2;2
3;Q93;Monosomien und Deletionen der Autosomen, anderenorts nicht klassifiziert;11;16
3;Q95;Balancierte Chromosomen-Rearrangements und Struktur-Marker, anderenorts nicht klassifiziert;0;0
3;Q96;Turner-Syndrom;12;59
3;Q97;Sonstige Anomalien der Gonosomen bei weiblichem Phänotyp, anderenorts nicht klassifiziert;2;2
3;Q98;Sonstige Anomalien der Gonosomen bei männlichem Phänotyp, anderenorts nicht klassifiziert;5;7
3;Q99;Sonstige Chromosomenanomalien, anderenorts nicht klassifiziert;9;20
3;R00;Störungen des Herzschlages;26;81
3;R01;Herzgeräusche und andere Herz-Schallphänomene;7;22
3;R02;Gangrän, anderenorts nicht klassifiziert;5;6
3;R03;Abnormer Blutdruckwert ohne Diagnose;2;2
3;R04;Blutung aus den Atemwegen;14;68
3;R05;Husten;23;66
3;R06;Störungen der Atmung;78;1020
3;R07;Hals- und Brustschmerzen;32;598
3;R09;Sonstige Symptome, die das Kreislaufsystem und das Atmungssystem betreffen;10;42
3;R10;Bauch- und Beckenschmerzen;72;2858
3;R11;Übelkeit und Erbrechen;49;199
3;R12;Sodbrennen;5;14
3;R13;Dysphagie;48;340
3;R14;Flatulenz und verwandte Zustände;16;37
3;R15;Stuhlinkontinenz;26;334
3;R16;Hepatomegalie und Splenomegalie, anderenorts nicht klassifiziert;16;35
3;R17;Gelbsucht, nicht näher bezeichnet;2;2
3;R18;Aszites;20;127
3;R19;Sonstige Symptome, die das Verdauungssystem und das Abdomen betreffen;20;58
3;R20;Sensibilitätsstörungen der Haut;42;570
3;R21;Hautausschlag und sonstige unspezifische Hauteruptionen;12;15
3;R22;Lokalisierte Schwellung, Raumforderung und Knoten der Haut und der Unterhaut;27;72
3;R23;Sonstige Hautveränderungen;18;28
3;R25;Abnorme unwillkürliche Bewegungen;32;89
3;R26;Störungen des Ganges und der Mobilität;167;9227
3;R27;Sonstige Koordinationsstörungen;32;48
3;R29;Sonstige Symptome, die das Nervensystem und das Muskel-Skelett-System betreffen;111;576
3;R30;Schmerzen beim Wasserlassen;4;8
3;R31;Nicht näher bezeichnete Hämaturie;17;62
3;R32;Nicht näher bezeichnete Harninkontinenz;25;619
3;R33;Harnverhaltung;8;20
3;R34;Anurie und Oligurie;0;0
3;R35;Polyurie;6;9
3;R36;Ausfluss aus der Harnröhre;0;0
3;R39;Sonstige Symptome, die das Harnsystem betreffen;27;170
3;R40;Somnolenz, Sopor und Koma;8;10
3;R41;Sonstige Symptome, die das Erkennungsvermögen und das Bewusstsein betreffen;28;96
3;R42;Schwindel und Taumel;108;1344
3;R43;Störungen des Geruchs- und Geschmackssinnes;6;8
3;R44;Sonstige Symptome, die die Sinneswahrnehmungen und das Wahrnehmungsvermögen betreffen;5;5
3;R45;Symptome, die die Stimmung betreffen;11;14
3;R46;Symptome, die das äußere Erscheinungsbild und das Verhalten betreffen;6;21
3;R47;Sprech- und Sprachstörungen, anderenorts nicht klassifiziert;36;193
3;R48;Dyslexie und sonstige Werkzeugstörungen, anderenorts nicht klassifiziert;4;7
3;R49;Störungen der Stimme;6;111
3;R50;Fieber sonstiger und unbekannter Ursache;20;62
3;R51;Kopfschmerz;64;788
3;R52;Schmerz, anderenorts nicht klassifiziert;108;1252
3;R53;Unwohlsein und Ermüdung;50;192
3;R54;Senilität;9;12
3;R55;Synkope und Kollaps;77;415
3;R56;Krämpfe, anderenorts nicht klassifiziert;41;366
3;R57;Schock, anderenorts nicht klassifiziert;4;5
3;R58;Blutung, anderenorts nicht klassifiziert;2;2
3;R59;Lymphknotenvergrößerung;47;182
3;R60;Ödem, anderenorts nicht klassifiziert;8;12
3;R61;Hyperhidrose;15;56
3;R62;Ausbleiben der erwarteten normalen physiologischen Entwicklung;43;462
3;R63;Symptome, die die Nahrungs- und Flüssigkeitsaufnahme betreffen;60;158
3;R64;Kachexie;10;13
3;R65;Systemisches inflammatorisches Response-Syndrom [SIRS];0;0
3;R68;Sonstige Allgemeinsymptome;12;46
3;R69;Unbekannte und nicht näher bezeichnete Krankheitsursachen;3;19
3;R70;Beschleunigte Blutkörperchensenkungsreaktion und Veränderungen der Plasmaviskosität;-999;-999
3;R71;Veränderung der Erythrozyten;-999;-999
3;R72;Veränderung der Leukozyten, anderenorts nicht klassifiziert;4;8
3;R73;Erhöhter Blutglukosewert;22;259
3;R74;Abnorme Serumenzymwerte;24;63
3;R75;Laborhinweis auf Humanes Immundefizienz-Virus [HIV];0;0
3;R76;Sonstige abnorme immunologische Serumbefunde;3;3
3;R77;Sonstige Veränderungen der Plasmaproteine;4;7
3;R78;Nachweis von Drogen und anderen Substanzen, die normalerweise nicht im Blut vorhanden sind;0;0
3;R79;Sonstige abnorme Befunde der Blutchemie;5;34
3;R80;Isolierte Proteinurie;9;17
3;R81;Glukosurie;-999;-999
3;R82;Sonstige abnorme Urinbefunde;2;4
3;R83;Abnorme Liquorbefunde;6;6
3;R84;Abnorme Befunde in Untersuchungsmaterialien aus Atemwegen und Thorax;0;0
3;R85;Abnorme Befunde in Untersuchungsmaterialien aus Verdauungsorganen und Bauchhöhle;-999;-999
3;R86;Abnorme Befunde in Untersuchungsmaterialien aus den männlichen Genitalorganen;0;0
3;R87;Abnorme Befunde in Untersuchungsmaterialien aus den weiblichen Genitalorganen;-999;-999
3;R89;Abnorme Befunde in Untersuchungsmaterialien aus anderen Körperorganen, -systemen und -geweben;4;4
3;R90;Abnorme Befunde bei der bildgebenden Diagnostik des Zentralnervensystems;13;29
3;R91;Abnorme Befunde bei der bildgebenden Diagnostik der Lunge;17;153
3;R92;Abnorme Befunde bei der bildgebenden Diagnostik der Mamma [Brustdrüse];2;40
3;R93;Abnorme Befunde bei der bildgebenden Diagnostik sonstiger Körperstrukturen;17;94
3;R94;Abnorme Ergebnisse von Funktionsprüfungen;32;148
3;R95;Plötzlicher Kindstod;0;0
3;R96;Sonstiger plötzlicher Tod unbekannter Ursache;0;0
3;R98;Tod ohne Anwesenheit anderer Personen;0;0
3;R99;Sonstige ungenau oder nicht näher bezeichnete Todesursachen;0;0
3;S00;Oberflächliche Verletzung des Kopfes;11;32
3;S01;Offene Wunde des Kopfes;14;86
3;S02;Fraktur des Schädels und der Gesichtsschädelknochen;25;117
3;S03;Luxation, Verstauchung und Zerrung von Gelenken und Bändern des Kopfes;3;9
3;S04;Verletzung von Hirnnerven;-999;-999
3;S05;Verletzung des Auges und der Orbita;6;19
3;S06;Intrakranielle Verletzung;77;752
3;S07;Zerquetschung des Kopfes;0;0
3;S08;Traumatische Amputation von Teilen des Kopfes;-999;-999
3;S09;Sonstige und nicht näher bezeichnete Verletzungen des Kopfes;6;32
3;S10;Oberflächliche Verletzung des Halses;4;4
3;S11;Offene Wunde des Halses;0;0
3;S12;Fraktur im Bereich des Halses;12;60
3;S13;Luxation, Verstauchung und Zerrung von Gelenken und Bändern in Halshöhe;6;15
3;S14;Verletzung der Nerven und des Rückenmarkes in Halshöhe;7;7
3;S15;Verletzung von Blutgefäßen in Halshöhe;-999;-999
3;S16;Verletzung von Muskeln und Sehnen in Halshöhe;-999;-999
3;S17;Zerquetschung des Halses;0;0
3;S18;Traumatische Amputation in Halshöhe;0;0
3;S19;Sonstige und nicht näher bezeichnete Verletzungen des Halses;0;0
3;S20;Oberflächliche Verletzung des Thorax;14;22
3;S21;Offene Wunde des Thorax;0;0
3;S22;Fraktur der Rippe(n), des Sternums und der Brustwirbelsäule;78;252
3;S23;Luxation, Verstauchung und Zerrung von Gelenken und Bändern im Bereich des Thorax;-999;-999
3;S24;Verletzung der Nerven und des Rückenmarkes in Thoraxhöhe;0;0
3;S25;Verletzung von Blutgefäßen des Thorax;0;0
3;S26;Verletzung des Herzens;0;0
3;S27;Verletzung sonstiger und nicht näher bezeichneter intrathorakaler Organe;4;4
3;S28;Zerquetschung des Thorax und traumatische Amputation von Teilen des Thorax;0;0
3;S29;Sonstige und nicht näher bezeichnete Verletzungen des Thorax;0;0
3;S30;Oberflächliche Verletzung des Abdomens, der Lumbosakralgegend und des Beckens;31;41
3;S31;Offene Wunde des Abdomens, der Lumbosakralgegend und des Beckens;4;9
3;S32;Fraktur der Lendenwirbelsäule und des Beckens;116;727
3;S33;Luxation, Verstauchung und Zerrung von Gelenken und Bändern der Lendenwirbelsäule und des Beckens;2;2
3;S34;Verletzung der Nerven und des lumbalen Rückenmarkes in Höhe des Abdomens, der Lumbosakralgegend und des Beckens;3;3
3;S35;Verletzung von Blutgefäßen in Höhe des Abdomens, der Lumbosakralgegend und des Beckens;0;0
3;S36;Verletzung von intraabdominalen Organen;11;12
3;S37;Verletzung der Harnorgane und der Beckenorgane;-999;-999
3;S38;Zerquetschung und traumatische Amputation von Teilen des Abdomens, der Lumbosakralgegend und des Beckens;0;0
3;S39;Sonstige und nicht näher bezeichnete Verletzungen des Abdomens, der Lumbosakralgegend und des Beckens;-999;-999
3;S40;Oberflächliche Verletzung der Schulter und des Oberarmes;9;9
3;S41;Offene Wunde der Schulter und des Oberarmes;0;0
3;S42;Fraktur im Bereich der Schulter und des Oberarmes;109;670
3;S43;Luxation, Verstauchung und Zerrung von Gelenken und Bändern des Schultergürtels;19;29
3;S44;Verletzung von Nerven in Höhe der Schulter und des Oberarmes;-999;-999
3;S45;Verletzung von Blutgefäßen in Höhe der Schulter und des Oberarmes;0;0
3;S46;Verletzung von Muskeln und Sehnen in Höhe der Schulter und des Oberarmes;5;5
3;S47;Zerquetschung der Schulter und des Oberarmes;0;0
3;S48;Traumatische Amputation an Schulter und Oberarm;0;0
3;S49;Sonstige und nicht näher bezeichnete Verletzungen der Schulter und des Oberarmes;-999;-999
3;S50;Oberflächliche Verletzung des Unterarmes;2;4
3;S51;Offene Wunde des Unterarmes;0;0
3;S52;Fraktur des Unterarmes;62;159
3;S53;Luxation, Verstauchung und Zerrung des Ellenbogengelenkes und von Bändern des Ellenbogens;10;11
3;S54;Verletzung von Nerven in Höhe des Unterarmes;3;3
3;S55;Verletzung von Blutgefäßen in Höhe des Unterarmes;0;0
3;S56;Verletzung von Muskeln und Sehnen in Höhe des Unterarmes;-999;-999
3;S57;Zerquetschung des Unterarmes;0;0
3;S58;Traumatische Amputation am Unterarm;0;0
3;S59;Sonstige und nicht näher bezeichnete Verletzungen des Unterarmes;-999;-999
3;S60;Oberflächliche Verletzung des Handgelenkes und der Hand;7;10
3;S61;Offene Wunde des Handgelenkes und der Hand;7;14
3;S62;Fraktur im Bereich des Handgelenkes und der Hand;4;14
3;S63;Luxation, Verstauchung und Zerrung von Gelenken und Bändern in Höhe des Handgelenkes und der Hand;3;6
3;S64;Verletzung von Nerven in Höhe des Handgelenkes und der Hand;-999;-999
3;S65;Verletzung von Blutgefäßen in Höhe des Handgelenkes und der Hand;0;0
3;S66;Verletzung von Muskeln und Sehnen in Höhe des Handgelenkes und der Hand;2;3
3;S67;Zerquetschung des Handgelenkes und der Hand;0;0
3;S68;Traumatische Amputation an Handgelenk und Hand;2;2
3;S69;Sonstige und nicht näher bezeichnete Verletzungen des Handgelenkes und der Hand;-999;-999
3;S70;Oberflächliche Verletzung der Hüfte und des Oberschenkels;26;33
3;S71;Offene Wunde der Hüfte und des Oberschenkels;0;0
3;S72;Fraktur des Femurs;115;1542
3;S73;Luxation, Verstauchung und Zerrung des Hüftgelenkes und von Bändern der Hüfte;8;9
3;S74;Verletzung von Nerven in Höhe der Hüfte und des Oberschenkels;-999;-999
3;S75;Verletzung von Blutgefäßen in Höhe der Hüfte und des Oberschenkels;0;0
3;S76;Verletzung von Muskeln und Sehnen in Höhe der Hüfte und des Oberschenkels;16;19
3;S77;Zerquetschung der Hüfte und des Oberschenkels;0;0
3;S78;Traumatische Amputation an Hüfte und Oberschenkel;-999;-999
3;S79;Sonstige und nicht näher bezeichnete Verletzungen der Hüfte und des Oberschenkels;0;0
3;S80;Oberflächliche Verletzung des Unterschenkels;17;24
3;S81;Offene Wunde des Unterschenkels;4;5
3;S82;Fraktur des Unterschenkels, einschließlich des oberen Sprunggelenkes;84;278
3;S83;Luxation, Verstauchung und Zerrung des Kniegelenkes und von Bändern des Kniegelenkes;12;17
3;S84;Verletzung von Nerven in Höhe des Unterschenkels;2;3
3;S85;Verletzung von Blutgefäßen in Höhe des Unterschenkels;0;0
3;S86;Verletzung von Muskeln und Sehnen in Höhe des Unterschenkels;13;15
3;S87;Zerquetschung des Unterschenkels;0;0
3;S88;Traumatische Amputation am Unterschenkel;2;3
3;S89;Sonstige und nicht näher bezeichnete Verletzungen des Unterschenkels;0;0
3;S90;Oberflächliche Verletzung der Knöchelregion und des Fußes;9;12
