1;5-879;Andere Exzision und Resektion der Mamma;2697;615;4.3854;0.3927;0.5636;0.6856;0.7735;0.8402
1;5-881;Inzision der Mamma;11654;755;15.4358;0.509;0.6486;0.749;0.8239;0.8841
1;5-882;Operationen an der Brustwarze;4993;477;10.4675;0.5043;0.6727;0.7823;0.8544;0.9047
1;5-883;Plastische Operationen zur Vergrößerung der Mamma;2050;378;5.4233;0.4088;0.6034;0.7176;0.798;0.8624
1;5-884;Mammareduktionsplastik;7527;524;14.3645;0.4303;0.6215;0.738;0.8278;0.8895
1;5-885;Plastische Rekonstruktion der Mamma mit Haut- und Muskeltransplantation;3386;356;9.5112;0.5437;0.7129;0.8187;0.8789;0.922
1;5-886;Andere plastische Rekonstruktion der Mamma;8697;508;17.1201;0.4712;0.6591;0.7749;0.8556;0.9105
1;5-889;Andere Operationen an der Mamma;10531;558;18.8728;0.4817;0.6636;0.7768;0.8531;0.9071
1;5-890;Tätowieren und Einbringen von Fremdmaterial in Haut und Unterhaut;1485;174;8.5345;0.604;0.7832;0.8572;0.901;0.93
1;5-891;Inzision eines Sinus pilonidalis;1471;473;3.1099;0.4337;0.5969;0.7022;0.7736;0.8389
1;5-892;Andere Inzision an Haut und Unterhaut;144775;1203;120.345;0.3938;0.5631;0.6876;0.7812;0.8554
1;5-894;Lokale Exzision von erkranktem Gewebe an Haut und Unterhaut;104944;1163;90.2356;0.3984;0.569;0.6855;0.7772;0.8496
1;5-895;Radikale und ausgedehnte Exzision von erkranktem Gewebe an Haut und Unterhaut;154353;1125;137.2027;0.6779;0.796;0.8652;0.9105;0.9419
1;5-896;Chirurgische Wundtoilette [Wunddebridement] mit Entfernung von erkranktem Gewebe an Haut und Unterhaut;229061;1205;190.0921;0.4029;0.5887;0.7156;0.8069;0.8741
1;5-897;Exzision und Rekonstruktion eines Sinus pilonidalis;26791;989;27.089;0.2703;0.4366;0.5702;0.68;0.7734
1;5-898;Operationen am Nagelorgan;13075;981;13.3282;0.5215;0.6823;0.7817;0.848;0.8974
1;5-899;Andere Exzision an Haut und Unterhaut;870;423;2.0567;0.3517;0.5069;0.6034;0.70;0.7575
1;5-900;Einfache Wiederherstellung der Oberflächenkontinuität an Haut und Unterhaut;173043;1191;145.2922;0.3488;0.5385;0.6755;0.7801;0.8612
1;5-901;Freie Hauttransplantation, Entnahmestelle;17028;916;18.5895;0.5497;0.7098;0.8107;0.8764;0.9205
1;5-902;Freie Hauttransplantation, Empfängerstelle;52432;1041;50.367;0.5542;0.7281;0.8209;0.8824;0.9262
1;5-903;Lokale Lappenplastik an Haut und Unterhaut;99269;953;104.1647;0.7365;0.8854;0.9426;0.9681;0.9814
1;5-904;Lappenplastik an Haut und Unterhaut, Entnahmestelle;1709;321;5.324;0.505;0.6723;0.7718;0.8403;0.8888
1;5-905;Lappenplastik an Haut und Unterhaut, Empfängerstelle;5210;455;11.4505;0.5129;0.7148;0.8292;0.8923;0.9313
1;5-906;Kombinierte plastische Eingriffe an Haut und Unterhaut;3402;403;8.4417;0.6384;0.7698;0.8439;0.8942;0.9265
1;5-907;Revision einer Hautplastik;7385;611;12.0867;0.5628;0.7633;0.8593;0.9101;0.9412
1;5-908;Plastische Operation an Lippe und Mundwinkel;4972;440;11.30;0.5563;0.7751;0.8689;0.9133;0.9409
1;5-909;Andere Wiederherstellung und Rekonstruktion von Haut und Unterhaut;3559;509;6.9921;0.5667;0.7275;0.8202;0.8741;0.9121
1;5-910;Straffungsoperation am Gesicht;328;118;2.7797;0.4238;0.5732;0.6738;0.75;0.8201
1;5-911;Gewebereduktion an Haut und Unterhaut;17734;687;25.8137;0.5886;0.7911;0.8807;0.9302;0.9603
1;5-912;Haartransplantation und Haartransposition;10;10;1.00;0.10;0.20;0.30;0.40;0.50
1;5-913;Entfernung oberflächlicher Hautschichten;26462;554;47.7653;0.8076;0.9212;0.961;0.9772;0.9854
1;5-914;Chemochirurgie der Haut;1483;88;16.8523;0.9022;0.9326;0.9481;0.9602;0.9703
1;5-915;Destruktion von erkranktem Gewebe an Haut und Unterhaut;10363;442;23.4457;0.7537;0.8938;0.9418;0.9633;0.9741
1;5-916;Temporäre Weichteildeckung;189981;1146;165.7775;0.4502;0.6199;0.7363;0.8186;0.8806
1;5-917;Syndaktylie- und Polydaktyliekorrektur der Finger;901;163;5.5276;0.5716;0.7003;0.7814;0.8391;0.8879
1;5-918;Syndaktylie- und Polydaktyliekorrektur der Zehen;369;110;3.3545;0.4363;0.5827;0.6911;0.7696;0.8293
1;5-919;Operative Versorgung von Mehrfachtumoren an einer Lokalisation der Haut in einer Sitzung;3296;189;17.4392;0.5664;0.7806;0.8735;0.9229;0.953
1;5-91a;Andere Operationen an Haut und Unterhaut;706;334;2.1138;0.3966;0.5397;0.6331;0.7167;0.7635
1;5-920;Inzision an Haut und Unterhaut bei Verbrennungen und Verätzungen;509;109;4.6697;0.5855;0.7603;0.8232;0.8664;0.8939
1;5-921;Chirurgische Wundtoilette [Wunddebridement] und Entfernung von erkranktem Gewebe an Haut und Unterhaut bei Verbrennungen und Verätzungen;31048;690;44.9971;0.8272;0.9129;0.9465;0.9661;0.9786
1;5-922;Wunddebridement an Muskel, Sehne und Faszie bei Verbrennungen und Verätzungen;664;247;2.6883;0.4623;0.6009;0.6943;0.7696;0.8148
1;5-923;Temporäre Weichteildeckung bei Verbrennungen und Verätzungen;12072;255;47.3412;0.7423;0.8678;0.9264;0.9586;0.978
1;5-924;Freie Hauttransplantation und Lappenplastik an Haut und Unterhaut bei Verbrennungen und Verätzungen, Entnahmestelle;465;163;2.8528;0.4516;0.6065;0.6968;0.7656;0.8258
1;5-925;Freie Hauttransplantation und Lappenplastik an Haut und Unterhaut bei Verbrennungen und Verätzungen, Empfängerstelle;5912;338;17.4911;0.8129;0.897;0.9345;0.9543;0.9674
1;5-926;Lokale Lappenplastik an Haut und Unterhaut bei Verbrennungen und Verätzungen;763;186;4.1022;0.5452;0.692;0.7667;0.8165;0.8663
1;5-927;Kombinierte plastische Eingriffe an Haut und Unterhaut bei Verbrennungen und Verätzungen;85;52;1.6346;0.2235;0.3765;0.5176;0.6353;0.6941
1;5-928;Primärer Wundverschluss der Haut und Revision einer Hautplastik bei Verbrennungen und Verätzungen;744;231;3.2208;0.5323;0.6532;0.7312;0.793;0.8454
1;5-929;Andere Operationen bei Verbrennungen und Verätzungen;160;47;3.4043;0.5625;0.6813;0.7563;0.8188;0.8563
1;5-930;Art des Transplantates;69649;706;98.653;0.4072;0.6191;0.7675;0.8652;0.9294
1;5-931;Art des verwendeten Knorpelersatz-, Knochenersatz- und Osteosynthesematerials;38941;639;60.9405;0.6477;0.846;0.9274;0.9635;0.9804
1;5-932;Art des verwendeten Materials für Gewebeersatz und Gewebeverstärkung;235442;1041;226.1691;0.2857;0.4481;0.5761;0.6844;0.7773
1;5-933;Verwendung einer Kunststoff- oder biologischen Membran zur Prophylaxe von Adhäsionen;4837;283;17.0919;0.7718;0.8658;0.9144;0.9436;0.9636
1;5-934;Verwendung von MRT-fähigem Material;39132;624;62.7115;0.4681;0.687;0.81;0.8867;0.9373
1;5-935;Verwendung von beschichtetem Osteosynthesematerial;1053;154;6.8377;0.6857;0.7968;0.8481;0.8879;0.9164
1;5-936;Verwendung von Arzneimitteln für neuartige Therapien;204;15;13.60;0.6667;0.7696;0.8922;0.9216;0.9608
1;5-937;Verwendung von thermomechanischem Osteosynthesematerial;237;35;6.7714;0.5105;0.6751;0.8101;0.8692;0.9156
1;5-981;Versorgung bei Mehrfachverletzung;1568;303;5.1749;0.5172;0.6901;0.7813;0.8463;0.8941
1;5-982;Versorgung bei Polytrauma;1746;233;7.4936;0.6237;0.7766;0.8448;0.8883;0.9192
1;5-983;Reoperation;176206;1096;160.7719;0.5706;0.7425;0.8433;0.9057;0.945
1;5-984;Mikrochirurgische Technik;409324;963;425.0509;0.5437;0.7292;0.8367;0.9028;0.9451
1;5-985;Lasertechnik;56740;661;85.8396;0.5161;0.7028;0.8226;0.8998;0.9473
1;5-986;Minimalinvasive Technik;82133;842;97.5451;0.5795;0.7644;0.8629;0.9212;0.9566
1;5-987;Anwendung eines OP-Roboters;18270;111;164.5946;0.3284;0.5226;0.6673;0.7712;0.8606
1;5-988;Anwendung eines Navigationssystems;48186;480;100.3875;0.4431;0.6427;0.7638;0.8517;0.914
1;5-989;Fluoreszenzgestützte Therapieverfahren;9675;228;42.4342;0.5279;0.7174;0.8224;0.8952;0.9406
1;5-98a;Hybridtherapie;10133;371;27.3127;0.4186;0.6203;0.7648;0.8607;0.9182
1;5-98b;Anwendung eines flexiblen Ureterorenoskops;22656;299;75.7726;0.2995;0.4895;0.6299;0.7451;0.8397
1;5-98c;Anwendung eines Klammernahtgerätes;105846;851;124.3784;0.4288;0.6244;0.7537;0.8467;0.9116
1;5-98d;Verwendung von patientenindividuell hergestelltem Instrumentarium;2803;190;14.7526;0.4934;0.7053;0.8273;0.894;0.9344
1;5-98e;Intraoperative Blutflussmessung in Gefäßen;16713;186;89.8548;0.6209;0.8206;0.9243;0.97;0.9883
1;5-98f;Einsatz von Shavertechnik zur Weichteil- und Knochenabtragung bei Operationen an Nase, Nasennebenhöhlen und Gesichtsschädelknochen;1069;74;14.4459;0.5631;0.754;0.8531;0.9111;0.9467
1;5-995;Vorzeitiger Abbruch einer Operation (Eingriff nicht komplett durchgeführt);24392;1050;23.2305;0.4883;0.6791;0.7919;0.8659;0.9168
2;5-010;Schädeleröffnung über die Kalotte;102;8;12.75;0.7549;0.8824;0.8824;0.9412;0.9608
2;5-011;Zugang durch die Schädelbasis;93;9;10.3333;0.6774;0.828;0.9032;0.9355;0.957
2;5-012;Inzision der Schädelknochen [Kraniotomie und Kraniektomie];10;7;1.4286;0.30;0.30;0.50;0.60;0.70
2;5-013;Inzision von Gehirn und Hirnhäuten;36;3;12.00;0.8056;0.8056;0.8056;0.8056;0.9444
2;5-014;Stereotaktische Operationen an Schädel, Gehirn und Hirnhäuten;-999;-999;-999.00;-9.99;-9.99;-9.99;-9.99;-9.99
2;5-015;Exzision und Destruktion von erkranktem intrakraniellem Gewebe;42;4;10.50;0.8333;0.8333;0.8333;0.9524;0.9524
2;5-016;Exzision und Destruktion von erkranktem Gewebe der Schädelknochen;36;15;2.40;0.5278;0.5833;0.6944;0.75;0.8056
2;5-017;Inzision, Resektion und Destruktion an intrakraniellen Anteilen von Hirnnerven und Ganglien;78;2;39.00;0.8205;0.8205;0.8205;0.8205;0.8205
2;5-018;Mikrovaskuläre Dekompression von intrakraniellen Nerven;-999;-999;-999.00;-9.99;-9.99;-9.99;-9.99;-9.99
2;5-020;Kranioplastik;34;10;3.40;0.4412;0.7059;0.7941;0.8235;0.8529
2;5-021;Rekonstruktion der Hirnhäute;109;29;3.7586;0.6055;0.7431;0.7982;0.844;0.8716
2;5-022;Inzision am Liquorsystem;-999;-999;-999.00;-9.99;-9.99;-9.99;-9.99;-9.99
2;5-023;Anlegen eines Liquorshuntes [Shunt-Implantation];19;3;6.3333;0.6842;0.6842;0.6842;0.6842;0.9474
2;5-024;Revision und Entfernung von Liquorableitungen;12;4;3.00;0.50;0.50;0.50;0.75;0.75
2;5-025;Inzision, Exzision, Destruktion und Verschluss von intrakraniellen Blutgefäßen;2;2;1.00;0.50;0.50;0.50;0.50;0.50
2;5-026;Rekonstruktion von intrakraniellen Blutgefäßen;0;0;0;0;0;0;0;0
2;5-027;Anlegen eines Bypasses und Transposition von intrakraniellen Blutgefäßen;0;0;0;0;0;0;0;0
2;5-028;Funktionelle Eingriffe an Schädel, Gehirn und Hirnhäuten;-999;-999;-999.00;-9.99;-9.99;-9.99;-9.99;-9.99
2;5-029;Andere Operationen an Schädel, Gehirn und Hirnhäuten;0;0;0;0;0;0;0;0
2;5-030;Zugang zum kraniozervikalen Übergang und zur Halswirbelsäule;1210;37;32.7027;0.3959;0.5504;0.7132;0.8405;0.9116
2;5-031;Zugang zur Brustwirbelsäule;119;18;6.6111;0.605;0.7647;0.7983;0.8487;0.8992
2;5-032;Zugang zur Lendenwirbelsäule, zum Os sacrum und zum Os coccygis;8507;47;181.00;0.4706;0.6384;0.7807;0.8741;0.9272
2;5-033;Inzision des Spinalkanals;998;26;38.3846;0.3677;0.5261;0.7295;0.8487;0.9369
2;5-034;Inzision von Rückenmark und Rückenmarkhäuten;7;3;2.3333;0.7143;0.7143;0.7143;0.7143;0.8571
2;5-035;Exzision und Destruktion von erkranktem Gewebe des Rückenmarkes und der Rückenmarkhäute;196;17;11.5294;0.6378;0.6939;0.7806;0.8622;0.9235
2;5-036;Plastische Operationen an Rückenmark und Rückenmarkhäuten;515;27;19.0741;0.5709;0.6913;0.8252;0.9029;0.9379
2;5-037;Operationen an intraspinalen Blutgefäßen;190;2;95.00;0.9947;0.9947;0.9947;0.9947;0.9947
2;5-038;Operationen am spinalen Liquorsystem;554;17;32.5882;0.7437;0.8357;0.917;0.9585;0.9801
2;5-039;Andere Operationen an Rückenmark und Rückenmarkstrukturen;217;12;18.0833;0.3917;0.6221;0.9263;0.9631;0.9724
2;5-040;Inzision von Nerven;9;7;1.2857;0.3333;0.3333;0.4444;0.5556;0.6667
2;5-041;Exzision und Destruktion von (erkranktem) Gewebe von Nerven;258;59;4.3729;0.5116;0.6822;0.7752;0.8372;0.8837
2;5-042;Exzision eines Nerven zur Transplantation;2;2;1.00;0.50;0.50;0.50;0.50;0.50
2;5-043;Sympathektomie;38;2;19.00;0.9737;0.9737;0.9737;0.9737;0.9737
2;5-044;Epineurale Naht eines Nerven und Nervenplexus, primär;10;7;1.4286;0.30;0.30;0.50;0.60;0.70
2;5-045;Interfaszikuläre Naht eines Nerven und Nervenplexus, primär;-999;-999;-999.00;-9.99;-9.99;-9.99;-9.99;-9.99
2;5-046;Epineurale Naht eines Nerven und Nervenplexus, sekundär;5;4;1.25;0.40;0.40;0.40;0.60;0.60
2;5-047;Interfaszikuläre Naht eines Nerven und Nervenplexus, sekundär;4;4;1.00;0.25;0.25;0.25;0.50;0.50
2;5-048;Epineurale Naht eines Nerven und Nervenplexus mit Transplantation;-999;-999;-999.00;-9.99;-9.99;-9.99;-9.99;-9.99
2;5-049;Interfaszikuläre Naht eines Nerven und Nervenplexus mit Transplantation;0;0;0;0;0;0;0;0
2;5-04a;Perkutane Sympathikolyse mit Steuerung durch bildgebende Verfahren;0;0;0;0;0;0;0;0
2;5-050;Epineurale Naht eines Nerven und Nervenplexus mit Transposition, primär;-999;-999;-999.00;-9.99;-9.99;-9.99;-9.99;-9.99
2;5-051;Interfaszikuläre Naht eines Nerven und Nervenplexus mit Transposition, primär;3;2;1.50;0.6667;0.6667;0.6667;0.6667;0.6667
2;5-052;Epineurale Naht eines Nerven und Nervenplexus mit Transposition, sekundär;-999;-999;-999.00;-9.99;-9.99;-9.99;-9.99;-9.99
2;5-053;Interfaszikuläre Naht eines Nerven und Nervenplexus mit Transposition, sekundär;-999;-999;-999.00;-9.99;-9.99;-9.99;-9.99;-9.99
2;5-054;Epineurale Naht eines Nerven und Nervenplexus mit Transplantation und Transposition;0;0;0;0;0;0;0;0
2;5-055;Interfaszikuläre Naht eines Nerven und Nervenplexus mit Transplantation und Transposition;2;2;1.00;0.50;0.50;0.50;0.50;0.50
2;5-056;Neurolyse und Dekompression eines Nerven;2211;157;14.0828;0.616;0.7589;0.8476;0.8982;0.9331
2;5-057;Neurolyse und Dekompression eines Nerven mit Transposition;455;57;7.9825;0.7077;0.8132;0.8703;0.9055;0.9319
2;5-058;Andere Rekonstruktion eines Nerven und Nervenplexus;4;3;1.3333;0.50;0.50;0.50;0.50;0.75
2;5-059;Andere Operationen an Nerven und Ganglien;194;17;11.4118;0.4485;0.5619;0.6907;0.7938;0.8866
2;5-060;Inzision im Gebiet der Schilddrüse;8;7;1.1429;0.25;0.25;0.375;0.50;0.625
2;5-061;Hemithyreoidektomie;373;26;14.3462;0.4343;0.5898;0.7373;0.807;0.8901
2;5-062;Andere partielle Schilddrüsenresektion;277;37;7.4865;0.5812;0.7256;0.8087;0.8664;0.9134
2;5-063;Thyreoidektomie;615;27;22.7778;0.4732;0.6276;0.7691;0.8667;0.9171
2;5-064;Operationen an der Schilddrüse durch Sternotomie;0;0;0;0;0;0;0;0
2;5-065;Exzision des Ductus thyreoglossus;216;95;2.2737;0.338;0.5139;0.6157;0.6991;0.7824
2;5-066;Partielle Nebenschilddrüsenresektion;25;3;8.3333;0.72;0.72;0.72;0.72;0.96
2;5-067;Parathyreoidektomie;30;6;5.00;0.60;0.60;0.7333;0.7333;0.8333
2;5-068;Operationen an der Nebenschilddrüse durch Sternotomie;0;0;0;0;0;0;0;0
2;5-069;Andere Operationen an Schilddrüse und Nebenschilddrüsen;1257;32;39.2813;0.4837;0.7104;0.8369;0.8918;0.934
2;5-070;Exploration der (Umgebung der) Nebenniere;0;0;0;0;0;0;0;0
2;5-071;Partielle Adrenalektomie;-999;-999;-999.00;-9.99;-9.99;-9.99;-9.99;-9.99
2;5-072;Adrenalektomie;19;12;1.5833;0.1579;0.2632;0.4737;0.5789;0.6842
2;5-073;Andere Operationen an der Nebenniere;-999;-999;-999.00;-9.99;-9.99;-9.99;-9.99;-9.99
2;5-074;Exzision und Resektion von erkranktem Gewebe des Corpus pineale;0;0;0;0;0;0;0;0
2;5-075;Exzision und Resektion von erkranktem Gewebe der Hypophyse;0;0;0;0;0;0;0;0
2;5-076;Andere Operationen an der Hypophyse;0;0;0;0;0;0;0;0
2;5-077;Exzision und Resektion des Thymus;0;0;0;0;0;0;0;0
2;5-078;Andere Operationen am Thymus;0;0;0;0;0;0;0;0
2;5-079;Operationen an anderen endokrinen Drüsen;0;0;0;0;0;0;0;0
2;5-080;Inzision der Tränendrüse;0;0;0;0;0;0;0;0
2;5-081;Exzision von (erkranktem) Gewebe der Tränendrüse;3;3;1.00;0.3333;0.3333;0.3333;0.3333;0.6667
2;5-082;Andere Operationen an der Tränendrüse;-999;-999;-999.00;-9.99;-9.99;-9.99;-9.99;-9.99
2;5-084;Inzision von Tränensack und sonstigen Tränenwegen;75;12;6.25;0.7467;0.8133;0.8933;0.9067;0.92
2;5-085;Exzision von erkranktem Gewebe an Tränensack und sonstigen Tränenwegen;75;13;5.7692;0.72;0.84;0.8667;0.8933;0.92
2;5-086;Rekonstruktion des Tränenkanals und Tränenpunktes;411;15;27.40;0.9343;0.9489;0.9659;0.9708;0.9805
2;5-087;Dakryozystorhinostomie;336;52;6.4615;0.6429;0.747;0.8274;0.875;0.9048
2;5-088;Andere Rekonstruktion der Tränenwege;151;13;11.6154;0.8808;0.9272;0.9404;0.947;0.9603
2;5-089;Andere Operationen an den Tränenwegen;6;6;1.00;0.1667;0.1667;0.3333;0.3333;0.50
2;5-090;Inzision des (erkrankten) Augenlides;15;7;2.1429;0.3333;0.3333;0.5333;0.6667;0.80
2;5-091;Exzision und Destruktion von (erkranktem) Gewebe des Augenlides;562;59;9.5254;0.7011;0.8292;0.895;0.9235;0.9448
2;5-092;Operationen an Kanthus und Epikanthus;366;23;15.913;0.776;0.9262;0.9481;0.959;0.9699
2;5-093;Korrekturoperation bei Entropium und Ektropium;852;47;18.1277;0.838;0.9061;0.9366;0.9554;0.9695
2;5-094;Korrekturoperation bei Blepharoptosis;557;28;19.8929;0.7469;0.8438;0.8851;0.9264;0.9533
2;5-095;Naht des Augenlides;257;24;10.7083;0.7704;0.8833;0.9105;0.9416;0.9533
2;5-096;Andere Rekonstruktion der Augenlider;1052;52;20.2308;0.8498;0.9059;0.9363;0.9544;0.9677
2;5-097;Blepharoplastik;728;45;16.1778;0.8791;0.919;0.9437;0.956;0.9698
2;5-098;Vertikale Lidverlängerung;23;4;5.75;0.6522;0.6522;0.6522;0.8696;0.8696
2;5-099;Andere Operationen am Augenlid;4;4;1.00;0.25;0.25;0.25;0.50;0.50
2;5-10a;Verstärkende Eingriffe an einem geraden Augenmuskel;106;15;7.0667;0.5943;0.6981;0.7925;0.8302;0.8868
2;5-10b;Schwächende Eingriffe an einem geraden Augenmuskel;84;20;4.20;0.5833;0.6786;0.75;0.8214;0.869
2;5-10c;Chirurgie der Abrollstrecke (Faden-Operation, Myopexie);18;6;3.00;0.5556;0.5556;0.7222;0.7222;0.8333
2;5-10d;Transposition eines geraden Augenmuskels;4;4;1.00;0.25;0.25;0.25;0.50;0.50
2;5-10e;Andere Operationen an den geraden Augenmuskeln;40;5;8.00;0.85;0.85;0.90;0.90;0.95
2;5-10f;Verstärkende Eingriffe an einem schrägen Augenmuskel;4;4;1.00;0.25;0.25;0.25;0.50;0.50
2;5-10g;Schwächende Eingriffe an einem schrägen Augenmuskel;31;8;3.875;0.5484;0.7419;0.7419;0.8387;0.871
2;5-10h;Transposition eines schrägen Augenmuskels;0;0;0;0;0;0;0;0
2;5-10j;Andere Operationen an den schrägen Augenmuskeln;11;3;3.6667;0.7273;0.7273;0.7273;0.7273;0.9091
2;5-10k;Kombinierte Operationen an den Augenmuskeln;483;31;15.5806;0.4555;0.7122;0.8116;0.882;0.9379
2;5-10m;Andere Operationen an den Augenmuskeln;-999;-999;-999.00;-9.99;-9.99;-9.99;-9.99;-9.99
2;5-110;Operative Entfernung eines Fremdkörpers aus der Konjunktiva;-999;-999;-999.00;-9.99;-9.99;-9.99;-9.99;-9.99
2;5-112;Exzision und Destruktion von (erkranktem) Gewebe der Konjunktiva;66;21;3.1429;0.4545;0.6061;0.7121;0.7879;0.8485
2;5-113;Konjunktivaplastik;99;19;5.2105;0.3838;0.6364;0.7475;0.8283;0.8788
2;5-114;Lösung von Adhäsionen zwischen Konjunktiva und Augenlid;-999;-999;-999.00;-9.99;-9.99;-9.99;-9.99;-9.99
2;5-115;Naht der Konjunktiva;678;22;30.8182;0.7212;0.8599;0.944;0.9631;0.9764
2;5-119;Andere Operationen an der Konjunktiva;12;8;1.50;0.25;0.4167;0.4167;0.5833;0.6667
2;5-120;Operative Entfernung eines Fremdkörpers aus der Kornea;-999;-999;-999.00;-9.99;-9.99;-9.99;-9.99;-9.99
2;5-121;Inzision der Kornea;5;5;1.00;0.20;0.20;0.40;0.40;0.60
2;5-122;Operationen bei Pterygium;346;34;10.1765;0.50;0.7052;0.8035;0.8902;0.9306
2;5-123;Exzision und Destruktion von (erkranktem) Gewebe der Kornea;184;28;6.5714;0.4076;0.6685;0.7609;0.8424;0.8967
2;5-124;Naht der Kornea;234;25;9.36;0.5085;0.6496;0.7906;0.8419;0.8932
2;5-125;Hornhauttransplantation und Keratoprothetik;838;31;27.0323;0.5322;0.7327;0.8437;0.9045;0.9535
2;5-126;Refraktive Keratoplastik und andere Rekonstruktion der Kornea;29;4;7.25;0.6897;0.6897;0.6897;0.8966;0.8966
2;5-129;Andere Operationen an der Kornea;309;24;12.875;0.6084;0.7896;0.8447;0.8964;0.9288
2;5-130;Operative Entfernung eines Fremdkörpers aus der vorderen Augenkammer;9;5;1.80;0.4444;0.4444;0.6667;0.6667;0.7778
2;5-131;Senkung des Augeninnendruckes durch filtrierende Operationen;1689;49;34.4694;0.6963;0.8117;0.878;0.9224;0.955
2;5-132;Senkung des Augeninnendruckes durch Operationen am Corpus ciliare;977;50;19.54;0.521;0.741;0.8577;0.915;0.9458
2;5-133;Senkung des Augeninnendruckes durch Verbesserung der Kammerwasserzirkulation;1694;44;38.50;0.588;0.7952;0.866;0.9327;0.9587
2;5-134;Senkung des Augeninnendruckes durch nicht filtrierende Operationen;628;22;28.5455;0.5844;0.7866;0.8965;0.9315;0.9538
2;5-135;Exzision und Destruktion von erkranktem Gewebe an Iris, Corpus ciliare und Sklera;13;9;1.4444;0.3077;0.4615;0.5385;0.6154;0.6923
2;5-136;Andere Iridektomie und Iridotomie;46;14;3.2857;0.1522;0.4348;0.5435;0.6957;0.7609
2;5-137;Andere Operationen an der Iris;504;39;12.9231;0.4187;0.6925;0.7798;0.8472;0.8988
2;5-138;Operationen an der Sklera;593;20;29.65;0.7707;0.9005;0.941;0.9595;0.9713
2;5-139;Andere Operationen an Sklera, vorderer Augenkammer, Iris und Corpus ciliare;2510;47;53.4043;0.5518;0.7821;0.9127;0.9486;0.9669
2;5-140;Entfernung eines Fremdkörpers aus der Augenlinse;0;0;0;0;0;0;0;0
2;5-142;Kapsulotomie der Linse;636;38;16.7368;0.6777;0.8585;0.9041;0.9387;0.9623
2;5-143;Intrakapsuläre Extraktion der Linse;31;20;1.55;0.2581;0.4194;0.5484;0.6129;0.6774
2;5-144;Extrakapsuläre Extraktion der Linse [ECCE];23974;126;190.2698;0.4531;0.6328;0.7743;0.8654;0.9236
2;5-145;Andere Linsenextraktionen;246;41;6.00;0.3943;0.5772;0.6951;0.7764;0.8577
2;5-146;(Sekundäre) Einführung und Wechsel einer alloplastischen Linse;732;53;13.8113;0.4522;0.6516;0.7609;0.8347;0.9003
2;5-147;Revision und Entfernung einer alloplastischen Linse;281;43;6.5349;0.5694;0.726;0.79;0.847;0.9039
2;5-149;Andere Operationen an der Linse;3302;37;89.2432;0.7426;0.8831;0.9597;0.9761;0.9873
2;5-150;Entfernung eines Fremdkörpers aus dem hinteren Augenabschnitt;8;6;1.3333;0.375;0.375;0.50;0.50;0.625
2;5-152;Fixation der Netzhaut durch eindellende Operationen;206;27;7.6296;0.5777;0.6748;0.7767;0.8447;0.9029
2;5-153;Revision, Wechsel und Entfernung einer Cerclage oder Plombe, die zur Fixation der Netzhaut angelegt wurde;19;11;1.7273;0.2105;0.4211;0.5263;0.6316;0.7368
2;5-154;Andere Operationen zur Fixation der Netzhaut;3555;52;68.3654;0.4037;0.6681;0.8194;0.8869;0.9314
2;5-155;Destruktion von erkranktem Gewebe an Retina und Choroidea;2737;48;57.0208;0.7928;0.8783;0.913;0.9448;0.9675
2;5-156;Andere Operationen an der Retina;1483;46;32.2391;0.532;0.6878;0.797;0.8658;0.9252
2;5-157;Andere Operationen an der Choroidea;24;9;2.6667;0.625;0.7083;0.75;0.7917;0.8333
2;5-158;Pars-plana-Vitrektomie;10333;62;166.6613;0.4839;0.6561;0.7751;0.852;0.9058
2;5-159;Vitrektomie über anderen Zugang und andere Operationen am Corpus vitreum;5053;58;87.1207;0.6169;0.7799;0.8731;0.9373;0.9709
2;5-160;Orbitotomie;264;17;15.5294;0.6818;0.8068;0.8788;0.9205;0.947
2;5-161;Entfernung eines Fremdkörpers aus Orbita und Augapfel, n.n.bez.;17;8;2.125;0.4118;0.5882;0.5882;0.7059;0.7647
2;5-162;Entfernung des Augeninhaltes [Eviszeration];7;4;1.75;0.5714;0.5714;0.5714;0.7143;0.7143
2;5-163;Entfernung des Augapfels [Enukleation];40;15;2.6667;0.55;0.625;0.75;0.775;0.825
2;5-164;Andere Exzision, Destruktion und Exenteration der Orbita und Orbitainnenhaut;11;7;1.5714;0.3636;0.3636;0.5455;0.6364;0.7273
2;5-165;Sekundäre Einführung, Revision und Entfernung eines Orbitaimplantates;7;6;1.1667;0.2857;0.2857;0.4286;0.4286;0.5714
2;5-166;Revision und Rekonstruktion von Orbita und Augapfel;12;8;1.50;0.25;0.4167;0.4167;0.5833;0.6667
2;5-167;Rekonstruktion der Orbitawand;16;8;2.00;0.375;0.5625;0.5625;0.6875;0.75
2;5-168;Operationen am N. opticus;0;0;0;0;0;0;0;0
2;5-169;Andere Operationen an Orbita, Auge und Augapfel;136;14;9.7143;0.4191;0.7868;0.8603;0.9191;0.9338
2;5-180;Inzision am äußeren Ohr;22;13;1.6923;0.2273;0.4545;0.5455;0.6364;0.7273
2;5-181;Exzision und Destruktion von erkranktem Gewebe des äußeren Ohres;534;135;3.9556;0.5487;0.6685;0.7566;0.8146;0.867
2;5-182;Resektion der Ohrmuschel;123;69;1.7826;0.2683;0.4228;0.5366;0.6504;0.7236
2;5-183;Wundversorgung am äußeren Ohr;11;9;1.2222;0.1818;0.3636;0.4545;0.5455;0.6364
2;5-184;Plastische Korrektur abstehender Ohren;274;93;2.9462;0.3175;0.5255;0.6496;0.7263;0.7993
2;5-185;Konstruktion und Rekonstruktion des äußeren Gehörganges;1618;118;13.7119;0.6761;0.7948;0.8665;0.9141;0.9431
2;5-186;Plastische Rekonstruktion von Teilen der Ohrmuschel;87;46;1.8913;0.3448;0.4828;0.5977;0.6782;0.7356
2;5-187;Plastische Rekonstruktion der gesamten Ohrmuschel;16;11;1.4545;0.25;0.375;0.50;0.5625;0.6875
2;5-188;Andere Rekonstruktion des äußeren Ohres;38;23;1.6522;0.3684;0.5263;0.5789;0.6316;0.7105
2;5-189;Andere Operationen am äußeren Ohr;701;77;9.1039;0.5678;0.7532;0.8474;0.9058;0.9372
2;5-192;Revision einer Stapedektomie;63;19;3.3158;0.4921;0.6508;0.7778;0.8254;0.8571
2;5-193;Andere Operationen an den Gehörknöchelchen;21;7;3.00;0.6667;0.6667;0.7619;0.8095;0.8571
2;5-194;Myringoplastik [Tympanoplastik Typ I];604;122;4.9508;0.4768;0.6325;0.7368;0.803;0.8626
2;5-195;Tympanoplastik (Verschluss einer Trommelfellperforation und Rekonstruktion der Gehörknöchelchen);3501;144;24.3125;0.4696;0.6547;0.7678;0.8452;0.8943
2;5-197;Stapesplastik;479;67;7.1493;0.4301;0.5971;0.7286;0.8184;0.881
2;5-198;Fensterungsoperation des Promotoriums;51;4;12.75;0.7647;0.7647;0.7647;0.9412;0.9412
2;5-199;Andere mikrochirurgische Operationen am Mittelohr;35;8;4.375;0.7429;0.8286;0.8286;0.8571;0.8857
2;5-200;Parazentese [Myringotomie];6515;312;20.8814;0.4972;0.6893;0.8049;0.8757;0.9229
2;5-201;Entfernung einer Paukendrainage;125;69;1.8116;0.28;0.44;0.552;0.664;0.728
2;5-202;Inzision an Warzenfortsatz und Mittelohr;376;83;4.5301;0.4441;0.6569;0.7633;0.8298;0.8803
2;5-203;Mastoidektomie;481;64;7.5156;0.6091;0.7838;0.8649;0.9106;0.9335
2;5-204;Rekonstruktion des Mittelohres;821;68;12.0735;0.6017;0.7856;0.8563;0.9099;0.9415
2;5-205;Andere Exzisionen an Mittel- und Innenohr;343;49;7.00;0.6764;0.7784;0.8397;0.8834;0.9213
2;5-208;Inzision [Eröffnung] und Destruktion [Ausschaltung] des Innenohres;21;8;2.625;0.381;0.6667;0.6667;0.7619;0.8095
2;5-209;Andere Operationen am Mittel- und Innenohr;450;44;10.2273;0.3756;0.6533;0.78;0.8867;0.9289
2;5-210;Operative Behandlung einer Nasenblutung;1237;167;7.4072;0.7211;0.8019;0.8618;0.8989;0.9264
2;5-211;Inzision der Nase;550;119;4.6218;0.5891;0.7091;0.7909;0.8436;0.8873
2;5-212;Exzision und Destruktion von erkranktem Gewebe der Nase;1228;191;6.4293;0.6857;0.7785;0.8379;0.8779;0.9104
2;5-213;Resektion der Nase;65;40;1.625;0.2615;0.40;0.5231;0.6308;0.6923
2;5-214;Submuköse Resektion und plastische Rekonstruktion des Nasenseptums;42153;394;106.9873;0.4114;0.605;0.7288;0.818;0.882
2;5-215;Operationen an der unteren Nasenmuschel [Concha nasalis];57884;396;146.1717;0.457;0.6513;0.771;0.8499;0.9054
