2;5-216;Reposition einer Nasenfraktur;542;134;4.0448;0.4354;0.6292;0.7343;0.8063;0.8542
2;5-217;Plastische Rekonstruktion der äußeren Nase;1000;131;7.6336;0.654;0.787;0.849;0.893;0.925
2;5-218;Plastische Rekonstruktion der inneren und äußeren Nase [Septorhinoplastik];3414;210;16.2571;0.5934;0.7343;0.8187;0.8752;0.918
2;5-219;Andere Operationen an der Nase;56;46;1.2174;0.1964;0.3393;0.4286;0.50;0.5893
2;5-220;Nasennebenhöhlenpunktion;94;24;3.9167;0.5638;0.7766;0.8191;0.8511;0.8723
2;5-221;Operationen an der Kieferhöhle;6303;312;20.2019;0.499;0.6724;0.7871;0.8601;0.9102
2;5-222;Operation am Siebbein und an der Keilbeinhöhle;5627;266;21.1541;0.5337;0.6938;0.8018;0.8733;0.9209
2;5-223;Operationen an der Stirnhöhle;630;78;8.0769;0.6175;0.819;0.8778;0.9159;0.9381
2;5-224;Operationen an mehreren Nasennebenhöhlen;19556;319;61.3041;0.4401;0.6415;0.7577;0.8437;0.9052
2;5-225;Plastische Rekonstruktion der Nasennebenhöhlen;152;31;4.9032;0.3882;0.5855;0.7039;0.7961;0.875
2;5-229;Andere Operationen an den Nasennebenhöhlen;284;48;5.9167;0.6514;0.8134;0.8697;0.8979;0.9155
2;5-230;Zahnextraktion;976;71;13.7465;0.5768;0.7572;0.8627;0.9119;0.9447
2;5-231;Operative Zahnentfernung (durch Osteotomie);1773;67;26.4627;0.5172;0.6808;0.7958;0.8742;0.9261
2;5-232;Zahnsanierung durch Füllung;134;26;5.1538;0.6194;0.7239;0.8284;0.8582;0.903
2;5-233;Prothetischer Zahnersatz;12;6;2.00;0.3333;0.3333;0.5833;0.5833;0.75
2;5-235;Replantation, Transplantation, Implantation und Stabilisierung eines Zahnes;75;26;2.8846;0.48;0.6267;0.7333;0.7867;0.8267
2;5-236;Entfernung eines transplantierten Zahnes;0;0;0;0;0;0;0;0
2;5-237;Wurzelspitzenresektion und Wurzelkanalbehandlung;104;31;3.3548;0.3365;0.5192;0.6442;0.7404;0.8365
2;5-240;Inzision des Zahnfleisches und Osteotomie des Alveolarkammes;93;27;3.4444;0.5161;0.6237;0.7312;0.7957;0.8602
2;5-241;Gingivaplastik;294;34;8.6471;0.5374;0.8299;0.8878;0.9184;0.9388
2;5-242;Andere Operationen am Zahnfleisch;253;38;6.6579;0.5731;0.7391;0.8103;0.8775;0.913
2;5-243;Exzision einer odontogenen pathologischen Veränderung des Kiefers;626;54;11.5926;0.6118;0.7556;0.8307;0.8866;0.9233
2;5-244;Alveolarkammplastik und Vestibulumplastik;546;40;13.65;0.5385;0.7875;0.8608;0.9066;0.9377
2;5-245;Zahnfreilegung;7;4;1.75;0.5714;0.5714;0.5714;0.7143;0.7143
2;5-249;Andere Operationen und Maßnahmen an Gebiss, Zahnfleisch und Alveolen;318;32;9.9375;0.4654;0.7138;0.8553;0.9057;0.934
2;5-250;Inzision, Exzision und Destruktion von erkranktem Gewebe der Zunge;151;76;1.9868;0.2781;0.4371;0.5695;0.6623;0.7483
2;5-251;Partielle Glossektomie;49;31;1.5806;0.2245;0.3673;0.4898;0.6122;0.6939
2;5-252;Glossektomie;-999;-999;-999.00;-9.99;-9.99;-9.99;-9.99;-9.99
2;5-253;Rekonstruktion der Zunge;23;18;1.2778;0.2174;0.3913;0.4348;0.5217;0.6087
2;5-259;Andere Operationen an der Zunge;122;55;2.2182;0.5082;0.6066;0.6885;0.7295;0.7787
2;5-260;Inzision und Schlitzung einer Speicheldrüse und eines Speicheldrüsenausführungsganges;76;49;1.551;0.2895;0.4211;0.5526;0.6184;0.6842
2;5-261;Exzision von erkranktem Gewebe einer Speicheldrüse und eines Speicheldrüsenausführungsganges;131;68;1.9265;0.2748;0.4504;0.5649;0.6718;0.7405
2;5-262;Resektion einer Speicheldrüse;1212;174;6.9655;0.3787;0.5825;0.7153;0.8078;0.8729
2;5-263;Rekonstruktion einer Speicheldrüse und eines Speicheldrüsenausführungsganges;8;5;1.60;0.25;0.25;0.50;0.50;0.75
2;5-269;Andere Operationen an Speicheldrüse und Speicheldrüsenausführungsgang;34;12;2.8333;0.4118;0.7059;0.7647;0.7941;0.8235
2;5-270;Äußere Inzision und Drainage im Mund-, Kiefer- und Gesichtsbereich;213;61;3.4918;0.4272;0.6056;0.7371;0.7981;0.8592
2;5-271;Inzision des harten und weichen Gaumens;24;20;1.20;0.1667;0.3333;0.4167;0.50;0.5833
2;5-272;Exzision und Destruktion des (erkrankten) harten und weichen Gaumens;372;146;2.5479;0.4274;0.5511;0.6452;0.7204;0.8011
2;5-273;Inzision, Exzision und Destruktion in der Mundhöhle;314;87;3.6092;0.5446;0.6656;0.7484;0.8057;0.8631
2;5-274;Mundbodenplastik;25;12;2.0833;0.24;0.44;0.64;0.72;0.76
2;5-275;Palatoplastik;615;107;5.7477;0.5593;0.7366;0.8341;0.8797;0.9138
2;5-276;Plastische Rekonstruktion einer (angeborenen) Lippenspalte und Lippen-Kieferspalte;78;17;4.5882;0.3718;0.4872;0.6795;0.7949;0.859
2;5-277;Resektion des Mundbodens mit plastischer Rekonstruktion;12;7;1.7143;0.3333;0.3333;0.50;0.6667;0.75
2;5-278;Resektion der Wange mit plastischer Rekonstruktion;43;10;4.30;0.4884;0.6047;0.7209;0.8372;0.8837
2;5-279;Andere Operationen am Mund;264;54;4.8889;0.6591;0.7765;0.8295;0.875;0.8977
2;5-280;Transorale Inzision und Drainage eines pharyngealen oder parapharyngealen Abszesses;195;60;3.25;0.4615;0.6462;0.7385;0.80;0.8462
2;5-281;Tonsillektomie (ohne Adenotomie);14002;341;41.0616;0.4112;0.588;0.7216;0.8224;0.8922
2;5-282;Tonsillektomie mit Adenotomie;9033;318;28.4057;0.4423;0.6381;0.7608;0.8482;0.9062
2;5-284;Exzision und Destruktion einer Zungengrundtonsille;539;68;7.9265;0.7625;0.8534;0.8924;0.9202;0.9369
2;5-285;Adenotomie (ohne Tonsillektomie);6195;310;19.9839;0.5621;0.7467;0.8423;0.8998;0.9374
2;5-289;Andere Operationen an Gaumen- und Rachenmandeln;1680;258;6.5116;0.5464;0.6917;0.7804;0.844;0.8905
2;5-290;Pharyngotomie;10;5;2.00;0.50;0.50;0.70;0.70;0.80
2;5-291;Operationen an Kiemengangsresten;200;98;2.0408;0.315;0.49;0.595;0.695;0.755
2;5-292;Exzision und Destruktion von erkranktem Gewebe des Pharynx;290;65;4.4615;0.6931;0.7724;0.8345;0.8655;0.8897
2;5-293;Pharyngoplastik;49;14;3.50;0.4898;0.6735;0.7143;0.7959;0.8367
2;5-294;Andere Rekonstruktionen des Pharynx;1240;183;6.776;0.3927;0.604;0.7315;0.821;0.8847
2;5-295;Partielle Resektion des Pharynx [Pharynxteilresektion];31;19;1.6316;0.2581;0.4194;0.5484;0.6452;0.7097
2;5-296;Radikale Resektion des Pharynx [Pharyngektomie];2;2;1.00;0.50;0.50;0.50;0.50;0.50
2;5-299;Andere Operationen am Pharynx;26;17;1.5294;0.3846;0.4615;0.5385;0.6154;0.6923
2;5-300;Exzision und Destruktion von erkranktem Gewebe des Larynx;2910;258;11.2791;0.4515;0.6471;0.7608;0.8378;0.8948
2;5-301;Hemilaryngektomie;5;3;1.6667;0.60;0.60;0.60;0.60;0.80
2;5-302;Andere partielle Laryngektomie;105;33;3.1818;0.3333;0.581;0.7048;0.781;0.8476
2;5-303;Laryngektomie;7;3;2.3333;0.5714;0.5714;0.5714;0.5714;0.8571
2;5-310;Larynxverengende Eingriffe;26;12;2.1667;0.1923;0.3462;0.5385;0.6154;0.6923
2;5-311;Temporäre Tracheostomie;46;22;2.0909;0.3043;0.4565;0.6304;0.7174;0.7609
2;5-312;Permanente Tracheostomie;20;13;1.5385;0.15;0.40;0.50;0.60;0.70
2;5-313;Inzision des Larynx und andere Inzisionen der Trachea;21;18;1.1667;0.2381;0.3333;0.381;0.4762;0.5714
2;5-314;Exzision, Resektion und Destruktion (von erkranktem Gewebe) der Trachea;13;9;1.4444;0.1538;0.3077;0.4615;0.6154;0.6923
2;5-315;Rekonstruktion des Larynx;27;18;1.50;0.3704;0.4815;0.5185;0.5926;0.6667
2;5-316;Rekonstruktion der Trachea;140;72;1.9444;0.35;0.4714;0.5857;0.6857;0.7429
2;5-319;Andere Operationen an Larynx und Trachea;27;17;1.5882;0.3333;0.4444;0.5556;0.6296;0.7037
2;5-320;Exzision und Destruktion von erkranktem Gewebe eines Bronchus;26;4;6.50;0.3846;0.3846;0.3846;0.7692;0.7692
2;5-321;Andere Exzision und Resektion eines Bronchus (ohne Resektion des Lungenparenchyms);-999;-999;-999.00;-9.99;-9.99;-9.99;-9.99;-9.99
2;5-322;Atypische Lungenresektion;-999;-999;-999.00;-9.99;-9.99;-9.99;-9.99;-9.99
2;5-323;Segmentresektion und Bisegmentresektion der Lunge;0;0;0;0;0;0;0;0
2;5-324;Einfache Lobektomie und Bilobektomie der Lunge;0;0;0;0;0;0;0;0
2;5-325;Erweiterte Lobektomie und Bilobektomie der Lunge;0;0;0;0;0;0;0;0
2;5-327;Einfache (Pleuro-)Pneum(on)ektomie;0;0;0;0;0;0;0;0
2;5-328;Erweiterte (Pleuro-)Pneum(on)ektomie;0;0;0;0;0;0;0;0
2;5-329;Andere Exzisionen an Lunge und Bronchus;0;0;0;0;0;0;0;0
2;5-330;Inzision eines Bronchus;0;0;0;0;0;0;0;0
2;5-331;Inzision der Lunge;0;0;0;0;0;0;0;0
2;5-333;Adhäsiolyse an Lunge und Brustwand;3;2;1.50;0.6667;0.6667;0.6667;0.6667;0.6667
2;5-334;Rekonstruktion an Lunge und Bronchien;0;0;0;0;0;0;0;0
2;5-335;Lungentransplantation;0;0;0;0;0;0;0;0
2;5-339;Andere Operationen an Lunge und Bronchien;57;5;11.40;0.8947;0.8947;0.9298;0.9298;0.9649
2;5-340;Inzision von Brustwand und Pleura;18;11;1.6364;0.4444;0.50;0.5556;0.6111;0.7222
2;5-341;Inzision des Mediastinums;2;2;1.00;0.50;0.50;0.50;0.50;0.50
2;5-342;Exzision und Destruktion von erkranktem Gewebe des Mediastinums;0;0;0;0;0;0;0;0
2;5-343;Exzision und Destruktion von (erkranktem) Gewebe der Brustwand;65;15;4.3333;0.7231;0.7538;0.8154;0.8462;0.8923
2;5-344;Pleurektomie;3;2;1.50;0.6667;0.6667;0.6667;0.6667;0.6667
2;5-345;Pleurodese [Verödung des Pleuraspaltes];12;5;2.40;0.3333;0.3333;0.5833;0.5833;0.75
2;5-346;Plastische Rekonstruktion der Brustwand;9;9;1.00;0.1111;0.2222;0.3333;0.4444;0.5556
2;5-347;Operationen am Zwerchfell;10;7;1.4286;0.30;0.30;0.50;0.60;0.70
2;5-349;Andere Operationen am Thorax;30;15;2.00;0.4667;0.5333;0.6667;0.70;0.7667
2;5-350;Valvulotomie;0;0;0;0;0;0;0;0
2;5-351;Ersatz von Herzklappen durch Prothese;0;0;0;0;0;0;0;0
2;5-352;Wechsel von Herzklappenprothesen;0;0;0;0;0;0;0;0
2;5-353;Valvuloplastik;0;0;0;0;0;0;0;0
2;5-354;Andere Operationen an Herzklappen;0;0;0;0;0;0;0;0
2;5-355;Herstellung und Vergrößerung eines Septumdefektes des Herzens;0;0;0;0;0;0;0;0
2;5-356;Plastische Rekonstruktion des Herzseptums bei angeborenen Herzfehlern;-999;-999;-999.00;-9.99;-9.99;-9.99;-9.99;-9.99
2;5-357;Operationen bei kongenitalen Gefäßanomalien;0;0;0;0;0;0;0;0
2;5-358;Operationen bei kongenitalen Klappenanomalien des Herzens;0;0;0;0;0;0;0;0
2;5-359;Andere Operationen am Herzen bei kongenitalen Anomalien;0;0;0;0;0;0;0;0
2;5-35a;Minimalinvasive Operationen an Herzklappen;0;0;0;0;0;0;0;0
2;5-360;Desobliteration (Endarteriektomie) der Koronararterien;0;0;0;0;0;0;0;0
2;5-361;Anlegen eines aortokoronaren Bypass;-999;-999;-999.00;-9.99;-9.99;-9.99;-9.99;-9.99
2;5-362;Anlegen eines aortokoronaren Bypass durch minimalinvasive Technik;0;0;0;0;0;0;0;0
2;5-363;Andere Revaskularisation des Herzens;0;0;0;0;0;0;0;0
2;5-364;Anwendung eines mechanischen Anastomosensystems bei Operationen an den Koronargefäßen;0;0;0;0;0;0;0;0
2;5-369;Andere Operationen an den Koronargefäßen;0;0;0;0;0;0;0;0
2;5-370;Perikardiotomie und Kardiotomie;-999;-999;-999.00;-9.99;-9.99;-9.99;-9.99;-9.99
2;5-371;Chirurgische ablative Maßnahmen bei Tachyarrhythmie;0;0;0;0;0;0;0;0
2;5-372;Exzision und Destruktion von erkranktem Gewebe des Perikardes und Perikardektomie;0;0;0;0;0;0;0;0
2;5-373;Exzision und Destruktion von erkranktem Gewebe des Herzens;0;0;0;0;0;0;0;0
2;5-374;Rekonstruktion des Perikardes und des Herzens;0;0;0;0;0;0;0;0
2;5-375;Herz- und Herz-Lungen-Transplantation;0;0;0;0;0;0;0;0
2;5-376;Implantation und Entfernung eines herzunterstützenden Systems, offen chirurgisch;0;0;0;0;0;0;0;0
2;5-377;Implantation eines Herzschrittmachers, Defibrillators und Ereignis-Rekorders;887;18;49.2778;0.3585;0.6855;0.8264;0.929;0.956
2;5-378;Entfernung, Wechsel und Korrektur eines Herzschrittmachers und Defibrillators;537;18;29.8333;0.3892;0.6369;0.7523;0.8994;0.9534
2;5-379;Andere Operationen an Herz und Perikard;3;2;1.50;0.6667;0.6667;0.6667;0.6667;0.6667
2;5-37a;Minimalinvasive Rekonstruktion des Perikardes und des Herzens;0;0;0;0;0;0;0;0
2;5-37b;Offen chirurgische Implantation und Entfernung von Kanülen für die Anwendung eines extrakorporalen (herz- und) lungenunterstützenden Systems mit Gasaustausch;0;0;0;0;0;0;0;0
2;5-380;Inzision, Embolektomie und Thrombektomie von Blutgefäßen;501;21;23.8571;0.7904;0.9102;0.9421;0.9641;0.978
2;5-381;Endarteriektomie;1287;10;128.70;0.627;0.8819;0.9332;0.9573;0.9689
2;5-382;Resektion von Blutgefäßen mit Reanastomosierung;142;6;23.6667;0.8028;0.8028;0.9718;0.9718;0.9789
2;5-383;Resektion und Ersatz (Interposition) von (Teilen von) Blutgefäßen;29;6;4.8333;0.4138;0.4138;0.8276;0.8276;0.8966
2;5-384;Resektion und Ersatz (Interposition) an der Aorta;25;2;12.50;0.80;0.80;0.80;0.80;0.80
2;5-385;Unterbindung, Exzision und Stripping von Varizen;7645;66;115.8333;0.6794;0.8118;0.9007;0.9443;0.9721
2;5-386;Andere Exzision von (erkrankten) Blutgefäßen und Transplantatentnahme;227;15;15.1333;0.5727;0.7533;0.9339;0.9515;0.9692
2;5-387;Ligatur und Teilverschluss der Vena cava;0;0;0;0;0;0;0;0
2;5-388;Naht von Blutgefäßen;169;51;3.3137;0.503;0.6686;0.7515;0.8107;0.8521
2;5-389;Anderer operativer Verschluss an Blutgefäßen;89;35;2.5429;0.3596;0.5281;0.6517;0.7191;0.809
2;5-38a;Endovaskuläre Implantation von Stent-Prothesen;-999;-999;-999.00;-9.99;-9.99;-9.99;-9.99;-9.99
2;5-38b;Endoskopische Entnahme von Blutgefäßen zur Transplantation;0;0;0;0;0;0;0;0
2;5-390;Shuntoperationen zwischen großem und kleinem Kreislauf [Links-Rechts-Shunt];0;0;0;0;0;0;0;0
2;5-391;Anlegen eines intraabdominalen venösen Shuntes;0;0;0;0;0;0;0;0
2;5-392;Anlegen eines arteriovenösen Shuntes;104;6;17.3333;0.6827;0.6827;0.9423;0.9423;0.9615
2;5-393;Anlegen eines anderen Shuntes und Bypasses an Blutgefäßen;315;8;39.375;0.7048;0.8476;0.8476;0.9302;0.9587
2;5-394;Revision einer Blutgefäßoperation;264;17;15.5294;0.6364;0.8106;0.9167;0.9545;0.9697
2;5-395;Patchplastik an Blutgefäßen;111;11;10.0909;0.5766;0.7297;0.7928;0.8378;0.9189
2;5-396;Transposition von Blutgefäßen;4;2;2.00;0.75;0.75;0.75;0.75;0.75
2;5-397;Andere plastische Rekonstruktion von Blutgefäßen;2;2;1.00;0.50;0.50;0.50;0.50;0.50
2;5-398;Operationen am Glomus caroticum und anderen Paraganglien;5;5;1.00;0.20;0.20;0.40;0.40;0.60
2;5-399;Andere Operationen an Blutgefäßen;1328;115;11.5478;0.6416;0.7907;0.8758;0.9194;0.9465
2;5-400;Inzision von Lymphknoten und Lymphgefäßen;5;5;1.00;0.20;0.20;0.40;0.40;0.60
2;5-401;Exzision einzelner Lymphknoten und Lymphgefäße;2675;184;14.538;0.6692;0.8071;0.874;0.9189;0.9465
2;5-402;Regionale Lymphadenektomie (Ausräumung mehrerer Lymphknoten einer Region) als selbständiger Eingriff;395;122;3.2377;0.3722;0.5342;0.6532;0.7443;0.8051
2;5-403;Radikale zervikale Lymphadenektomie [Neck dissection];448;97;4.6186;0.3862;0.5603;0.7031;0.7946;0.8549
2;5-404;Radikale (systematische) Lymphadenektomie als selbständiger Eingriff;71;28;2.5357;0.3239;0.5211;0.6056;0.7042;0.7887
2;5-405;Operationen am Ductus thoracicus;0;0;0;0;0;0;0;0
2;5-406;Regionale Lymphadenektomie (Ausräumung mehrerer Lymphknoten einer Region) im Rahmen einer anderen Operation;392;57;6.8772;0.6046;0.7347;0.8265;0.8801;0.9133
2;5-407;Radikale (systematische) Lymphadenektomie im Rahmen einer anderen Operation;176;41;4.2927;0.5795;0.6875;0.7727;0.8352;0.8864
2;5-408;Andere Operationen am Lymphgefäßsystem;20;15;1.3333;0.25;0.35;0.50;0.55;0.65
2;5-410;Entnahme von hämatopoetischen Stammzellen aus Knochenmark und peripherem Blut zur Transplantation;-999;-999;-999.00;-9.99;-9.99;-9.99;-9.99;-9.99
2;5-411;Transplantation von hämatopoetischen Stammzellen aus dem Knochenmark;-999;-999;-999.00;-9.99;-9.99;-9.99;-9.99;-9.99
2;5-412;Inzision der Milz;0;0;0;0;0;0;0;0
2;5-413;Splenektomie;9;6;1.50;0.2222;0.2222;0.4444;0.4444;0.6667
2;5-418;Andere Operationen am Knochenmark;0;0;0;0;0;0;0;0
2;5-419;Andere Operationen an der Milz;4;2;2.00;0.75;0.75;0.75;0.75;0.75
2;5-420;Inzision des Ösophagus;4;3;1.3333;0.50;0.50;0.50;0.50;0.75
2;5-421;Ösophagostomie als selbständiger Eingriff;0;0;0;0;0;0;0;0
2;5-422;Lokale Exzision und Destruktion von erkranktem Gewebe des Ösophagus;28;18;1.5556;0.25;0.3929;0.4643;0.6071;0.6786
2;5-423;Partielle Ösophagusresektion ohne Wiederherstellung der Kontinuität;-999;-999;-999.00;-9.99;-9.99;-9.99;-9.99;-9.99
2;5-424;Partielle Ösophagusresektion mit Wiederherstellung der Kontinuität;-999;-999;-999.00;-9.99;-9.99;-9.99;-9.99;-9.99
2;5-425;(Totale) Ösophagektomie ohne Wiederherstellung der Kontinuität;0;0;0;0;0;0;0;0
2;5-426;(Totale) Ösophagektomie mit Wiederherstellung der Kontinuität;0;0;0;0;0;0;0;0
2;5-427;Rekonstruktion der Ösophaguspassage (als selbständiger Eingriff);0;0;0;0;0;0;0;0
2;5-428;Rekonstruktion der Ösophaguspassage bei Atresie und Versorgung einer kongenitalen ösophagotrachealen Fistel;0;0;0;0;0;0;0;0
2;5-429;Andere Operationen am Ösophagus;196;32;6.125;0.3469;0.5663;0.7398;0.8367;0.8827
2;5-430;Gastrotomie;0;0;0;0;0;0;0;0
2;5-431;Gastrostomie;106;44;2.4091;0.3585;0.5189;0.6132;0.7075;0.783
2;5-432;Operationen am Pylorus;10;5;2.00;0.50;0.50;0.70;0.70;0.80
2;5-433;Lokale Exzision und Destruktion von erkranktem Gewebe des Magens;113;23;4.913;0.3717;0.5929;0.708;0.8053;0.885
2;5-434;Atypische partielle Magenresektion;10;6;1.6667;0.30;0.30;0.50;0.50;0.70
2;5-435;Partielle Magenresektion (2/3-Resektion);5;2;2.50;0.80;0.80;0.80;0.80;0.80
2;5-436;Subtotale Magenresektion (4/5-Resektion);3;2;1.50;0.6667;0.6667;0.6667;0.6667;0.6667
2;5-437;(Totale) Gastrektomie;3;2;1.50;0.6667;0.6667;0.6667;0.6667;0.6667
2;5-438;(Totale) Gastrektomie mit Ösophagusresektion;0;0;0;0;0;0;0;0
2;5-439;Andere Inzision, Exzision und Resektion am Magen;0;0;0;0;0;0;0;0
2;5-444;Vagotomie;0;0;0;0;0;0;0;0
2;5-445;Gastroenterostomie ohne Magenresektion [Bypassverfahren];5;5;1.00;0.20;0.20;0.40;0.40;0.60
2;5-447;Revision nach Magenresektion;2;2;1.00;0.50;0.50;0.50;0.50;0.50
2;5-448;Andere Rekonstruktion am Magen;154;16;9.625;0.5714;0.6753;0.8247;0.8636;0.9286
2;5-449;Andere Operationen am Magen;181;29;6.2414;0.5359;0.7348;0.8066;0.8674;0.9061
2;5-450;Inzision des Darmes;4;4;1.00;0.25;0.25;0.25;0.50;0.50
2;5-451;Lokale Exzision und Destruktion von erkranktem Gewebe des Dünndarmes;73;30;2.4333;0.2603;0.4658;0.589;0.6849;0.7671
2;5-452;Lokale Exzision und Destruktion von erkranktem Gewebe des Dickdarmes;1961;74;26.50;0.6298;0.8205;0.9062;0.951;0.9699
2;5-453;Ausschaltung eines Darmsegmentes als selbständiger Eingriff (z.B. bei zweizeitigen plastischen Operationen);0;0;0;0;0;0;0;0
2;5-454;Resektion des Dünndarmes;71;21;3.381;0.4085;0.5775;0.7042;0.7887;0.8592
2;5-455;Partielle Resektion des Dickdarmes;364;27;13.4815;0.6538;0.7692;0.8791;0.9341;0.9643
2;5-456;(Totale) Kolektomie und Proktokolektomie;3;2;1.50;0.6667;0.6667;0.6667;0.6667;0.6667
2;5-459;Bypass-Anastomose des Darmes;5;5;1.00;0.20;0.20;0.40;0.40;0.60
2;5-460;Anlegen eines Enterostomas, doppelläufig, als selbständiger Eingriff;20;12;1.6667;0.15;0.30;0.55;0.65;0.70
2;5-461;Anlegen eines Enterostomas, endständig, als selbständiger Eingriff;8;6;1.3333;0.375;0.375;0.50;0.50;0.625
2;5-462;Anlegen eines Enterostomas (als protektive Maßnahme) im Rahmen eines anderen Eingriffes;30;8;3.75;0.4333;0.6667;0.6667;0.7667;0.8333
2;5-463;Anlegen anderer Enterostomata;8;2;4.00;0.75;0.75;0.75;0.75;0.75
2;5-464;Revision und andere Eingriffe an einem Enterostoma;15;6;2.50;0.40;0.40;0.6667;0.6667;0.80
2;5-465;Rückverlagerung eines doppelläufigen Enterostomas;47;14;3.3571;0.4043;0.6809;0.7234;0.8085;0.8511
2;5-466;Wiederherstellung der Kontinuität des Darmes bei endständigen Enterostomata;13;5;2.60;0.6923;0.6923;0.7692;0.7692;0.8462
2;5-467;Andere Rekonstruktion des Darmes;85;35;2.4286;0.40;0.5412;0.6824;0.7529;0.80
2;5-468;Intraabdominale Manipulation am Darm;3;3;1.00;0.3333;0.3333;0.3333;0.3333;0.6667
2;5-469;Andere Operationen am Darm;5420;183;29.6175;0.588;0.7699;0.8557;0.9081;0.9443
2;5-470;Appendektomie;715;69;10.3623;0.5706;0.7315;0.828;0.8937;0.9399
2;5-471;Simultane Appendektomie;91;39;2.3333;0.3846;0.5604;0.6593;0.7473;0.7912
2;5-479;Andere Operationen an der Appendix;2;2;1.00;0.50;0.50;0.50;0.50;0.50
2;5-480;Inzision des Rektums;5;3;1.6667;0.60;0.60;0.60;0.60;0.80
2;5-482;Peranale lokale Exzision und Destruktion von erkranktem Gewebe des Rektums;832;55;15.1273;0.4603;0.6815;0.8101;0.8738;0.9279
2;5-484;Rektumresektion unter Sphinktererhaltung;139;19;7.3158;0.4964;0.7266;0.8417;0.8993;0.9281
2;5-485;Rektumresektion ohne Sphinktererhaltung;5;2;2.50;0.60;0.60;0.60;0.60;0.60
2;5-486;Rekonstruktion des Rektums;289;31;9.3226;0.6332;0.7578;0.8547;0.9031;0.9377
2;5-489;Andere Operation am Rektum;82;27;3.037;0.3171;0.4634;0.6463;0.7561;0.8415
2;5-490;Inzision und Exzision von Gewebe der Perianalregion;1744;93;18.7527;0.676;0.8068;0.8802;0.9266;0.9558
2;5-491;Operative Behandlung von Analfisteln;2532;68;37.2353;0.5585;0.795;0.8803;0.9258;0.957
2;5-492;Exzision und Destruktion von erkranktem Gewebe des Analkanals;2170;76;28.5526;0.6525;0.8009;0.8926;0.9332;0.9608
2;5-493;Operative Behandlung von Hämorrhoiden;4084;89;45.8876;0.5392;0.7402;0.8359;0.8991;0.9474
2;5-494;Durchtrennung des Sphincter ani [Sphinkterotomie];21;12;1.75;0.1905;0.381;0.5714;0.6667;0.7143
2;5-495;Primäre plastische Rekonstruktion bei anorektalen Anomalien;9;4;2.25;0.3333;0.3333;0.3333;0.6667;0.6667
2;5-496;Rekonstruktion des Anus und des Sphinkterapparates;235;27;8.7037;0.4383;0.5872;0.7404;0.8383;0.8979
2;5-499;Andere Operationen am Anus;101;24;4.2083;0.5347;0.703;0.7723;0.8317;0.8713
2;5-500;Inzision der Leber;0;0;0;0;0;0;0;0
2;5-501;Lokale Exzision und Destruktion von erkranktem Gewebe der Leber (atypische Leberresektion);34;16;2.125;0.4412;0.5588;0.6765;0.7059;0.7647
2;5-502;Anatomische (typische) Leberresektion;-999;-999;-999.00;-9.99;-9.99;-9.99;-9.99;-9.99
2;5-503;Leberteilresektion und Hepatektomie (zur Transplantation);0;0;0;0;0;0;0;0
2;5-504;Lebertransplantation;0;0;0;0;0;0;0;0
2;5-505;Rekonstruktion der Leber;3;2;1.50;0.6667;0.6667;0.6667;0.6667;0.6667
2;5-506;Implantation, Wechsel und Entfernung eines Katheterverweilsystems in Leberarterie und Pfortader (zur Chemotherapie) und offen chirurgische intrahepatische Chemoperfusion;0;0;0;0;0;0;0;0
2;5-509;Andere Operationen an der Leber;0;0;0;0;0;0;0;0
2;5-510;Cholezystotomie und Cholezystostomie;0;0;0;0;0;0;0;0
2;5-511;Cholezystektomie;2083;53;39.3019;0.4105;0.6563;0.7984;0.8809;0.939
2;5-512;Biliodigestive Anastomose (von Ductus hepaticus, Ductus choledochus und Leberparenchym);0;0;0;0;0;0;0;0
2;5-513;Endoskopische Operationen an den Gallengängen;471;19;24.7895;0.4183;0.6497;0.7834;0.8854;0.9469
2;5-514;Andere Operationen an den Gallengängen;9;7;1.2857;0.2222;0.2222;0.4444;0.5556;0.6667
2;5-515;Exzision und Resektion von erkranktem Gewebe der Gallengänge;3;3;1.00;0.3333;0.3333;0.3333;0.3333;0.6667
2;5-516;Andere Rekonstruktion der Gallengänge;-999;-999;-999.00;-9.99;-9.99;-9.99;-9.99;-9.99
2;5-517;Einlegen oder Wechseln von selbstexpandierenden Stents und Stent-Prothesen in die Gallengänge;0;0;0;0;0;0;0;0
2;5-518;Operationen an Sphincter Oddi und Papilla duodeni major;0;0;0;0;0;0;0;0
2;5-519;Andere Operationen an Gallenblase und Gallengängen;0;0;0;0;0;0;0;0
2;5-520;Inzision des Pankreas;0;0;0;0;0;0;0;0
2;5-521;Lokale Exzision und Destruktion von erkranktem Gewebe des Pankreas;0;0;0;0;0;0;0;0
2;5-522;Marsupialisation einer Pankreaszyste;0;0;0;0;0;0;0;0
2;5-523;Innere Drainage des Pankreas;0;0;0;0;0;0;0;0
2;5-524;Partielle Resektion des Pankreas;5;3;1.6667;0.60;0.60;0.60;0.60;0.80
2;5-525;(Totale) Pankreatektomie;0;0;0;0;0;0;0;0
2;5-526;Endoskopische Operationen am Pankreasgang;15;4;3.75;0.5333;0.5333;0.5333;0.80;0.80
2;5-527;Anastomose des Ductus pancreaticus;0;0;0;0;0;0;0;0
2;5-528;Transplantation von Pankreas(gewebe);0;0;0;0;0;0;0;0
2;5-529;Andere Operationen am Pankreas und am Pankreasgang;7;5;1.40;0.2857;0.2857;0.5714;0.5714;0.7143
2;5-530;Verschluss einer Hernia inguinalis;7958;131;60.7481;0.5108;0.7437;0.8539;0.9146;0.9533
2;5-531;Verschluss einer Hernia femoralis;190;46;4.1304;0.4895;0.6263;0.7474;0.8105;0.8684
2;5-534;Verschluss einer Hernia umbilicalis;1503;111;13.5405;0.5449;0.7625;0.8623;0.9175;0.9501
2;5-535;Verschluss einer Hernia epigastrica;533;61;8.7377;0.4053;0.6098;0.7411;0.8236;0.8987
2;5-536;Verschluss einer Narbenhernie;1017;83;12.253;0.4356;0.6686;0.7955;0.8682;0.9243
2;5-537;Verschluss kongenitaler Bauchwanddefekte (Omphalozele, Laparoschisis);0;0;0;0;0;0;0;0
2;5-538;Verschluss einer Hernia diaphragmatica;174;15;11.60;0.6552;0.7816;0.9023;0.9253;0.954
2;5-539;Verschluss anderer abdominaler Hernien;81;39;2.0769;0.284;0.4444;0.5926;0.6914;0.7654
2;5-540;Inzision der Bauchwand;78;17;4.5882;0.7308;0.7564;0.8077;0.859;0.8974
2;5-541;Laparotomie und Eröffnung des Retroperitoneums;204;84;2.4286;0.3775;0.5441;0.6471;0.7353;0.7941
2;5-542;Exzision und Destruktion von erkranktem Gewebe der Bauchwand;77;43;1.7907;0.2987;0.4805;0.5844;0.6623;0.7273
2;5-543;Exzision und Destruktion von peritonealem Gewebe;405;79;5.1266;0.5111;0.6617;0.7679;0.837;0.8864
2;5-545;Verschluss von Bauchwand und Peritoneum;42;36;1.1667;0.2381;0.3095;0.4048;0.4762;0.5714
2;5-546;Plastische Rekonstruktion von Bauchwand und Peritoneum;142;46;3.087;0.4437;0.5775;0.6972;0.7606;0.831
2;5-547;Resektion von Gewebe in der Bauchregion ohne sichere Organzuordnung;34;17;2.00;0.3235;0.4412;0.5882;0.7059;0.7647
2;5-549;Andere Bauchoperationen;433;59;7.339;0.6767;0.7852;0.8453;0.8915;0.9238
2;5-550;Perkutan-transrenale Nephrotomie, Nephrostomie, Steinentfernung, Pyeloplastik und ureterorenoskopische Steinentfernung;1404;86;16.3256;0.4772;0.6481;0.7657;0.8476;0.9152
2;5-551;Offen chirurgische Nephrotomie, Nephrostomie, Pyelotomie und Pyelostomie;23;15;1.5333;0.2174;0.3043;0.4783;0.5652;0.6957
2;5-552;Exzision und Destruktion von (erkranktem) Gewebe der Niere;112;46;2.4348;0.3125;0.4554;0.6071;0.6964;0.7857
2;5-553;Partielle Resektion der Niere;198;44;4.50;0.2828;0.4949;0.6111;0.7172;0.798
2;5-554;Nephrektomie;291;49;5.9388;0.299;0.4845;0.6186;0.7182;0.8041
2;5-555;Nierentransplantation;0;0;0;0;0;0;0;0
2;5-557;Rekonstruktion der Niere;98;32;3.0625;0.2551;0.449;0.6327;0.7245;0.7959
2;5-559;Andere Operationen an der Niere;14;11;1.2727;0.1429;0.2857;0.4286;0.50;0.6429
2;5-560;Transurethrale und perkutan-transrenale Erweiterung des Ureters;4075;91;44.7802;0.5514;0.7345;0.8434;0.907;0.9546
2;5-561;Inzision, Resektion und (andere) Erweiterung des Ureterostiums;297;69;4.3043;0.4108;0.5993;0.7172;0.8013;0.8586
2;5-562;Ureterotomie, perkutan-transrenale und transurethrale Steinbehandlung;4394;111;39.5856;0.4802;0.6661;0.7763;0.8514;0.9103
2;5-563;Exzision und Destruktion von erkranktem Gewebe des Ureters, Ureterresektion und Ureterektomie;146;44;3.3182;0.3493;0.5753;0.6712;0.7671;0.8219
2;5-564;Kutane Harnableitung durch Ureterokutaneostomie (nicht kontinentes Stoma);17;9;1.8889;0.2353;0.4118;0.5882;0.7059;0.7647
